"LICITACIÓN PRIVADA","Sin Modalidad","5",2018,"ADQUISICION DE MATERIAL DESCARTABLES PARA LA FARMACIA DEL HOSPITAL REGIONAL VERA",,"EQUIPOS Y ELEMENTOS PARA FILMACION Y REPRODUCCION/EQUIPOS Y ELEMENTOS P/REPRODUCIR IMAGENES|  PROD.MEDICINALES-PROD.QUIM.-INSUMOS P/ENV.MEDICINALES/INSUMOS PARA ENVASES MEDICINALES|  ENVASES DISTINTOS USOS/ENVASES DISTINTOS USOS|  EQUIP.MEDICO P/HOSPITALES Y CENTROS SANITARIOS/MATERIAL DESCARTABLE|  EQUIPOS Y ELEMENTOS VARIOS/ELEMENTOS VARIOS","PESOS",600000,"HOSPITAL REGIONAL VERA","HOSPITAL REGIONAL VERA","08-08-2018 09:00 hs.",,"PESOS","$ 250",,"https://www.santafe.gov.ar/gestionesdecompras/site/gestion.php?idGestion=121292&contar=1&solodocs=1","EN TRAMITE","08-08-2018 23:20 hs."
"CONTRATACIÓN DIRECTA","Sin Modalidad","5",2018,"INSUMOS DE QUIROFANO ",,"EQUIP.MEDICO P/HOSPITALES Y CENTROS SANITARIOS/EQUIPOS, INSTRUMENTAL E INSUMOS MEDICOS","PESOS",70600,"HOSPITAL PROTOMÉDICO MANUEL RODRIGUEZ","HOSPITAL PROTOMÉDICO MANUEL RODRIGUEZ","04-04-2018 10:00 hs.",,"PESOS",,"5014","https://www.santafe.gov.ar/gestionesdecompras/site/gestion.php?idGestion=120827&contar=1&solodocs=1","CONCLUIDA","10-04-2018 12:14 hs."
"CONTRATACIÓN DIRECTA","Sin Modalidad","5",2018,"IMPRESIÓN DE 100 LIBROS MEMORIA 2017 - TRIBUNAL DE CUENTAS DE LA PROVINCIA DE SANTA FE Y 100 LIBROS CUENTA DE INVERSIÓN - TRIBUNAL DE CUENTAS DE LA PROVINCIA","IMPRESIÓN DE 100 LIBROS MEMORIA 2017 - TRIBUNAL DE CUENTAS DE LA PROVINCIA DE SANTA FE Y 100 LIBROS CUENTA DE INVERSIÓN - TRIBUNAL DE CUENTAS DE LA PROVINCIA","SERVICIOS COMERCIALES Y FINANCIEROS/IMPRENTA, PUBLICACIONES, REPRODUCCIONES","PESOS",99520,"TRIBUNAL DE CUENTAS","TRIBUNAL DE CUENTAS","21-03-2018 10:00 hs.","SAN JERÓNIMO 1850 - D.G.A. - C.S.C. Y C.","PESOS",,"00901-0083630-6","https://www.santafe.gov.ar/gestionesdecompras/site/gestion.php?idGestion=120897&contar=1&solodocs=1","CONCLUIDA","10-05-2018 09:51 hs."
"CONCURSO PRIVADO","Sin Modalidad","5",2018,"ADQUISICION DE MEDICAMENTOS CON DESTINO A LA FARMACIA INTERNA DE ESTA COLONIA PSIQUIATRICA "" DR. A. I. FREYRE"" DE OLIVEROS","ADQUISICION DE MEDICAMENTOS CON DESTINO A LA FARMACIA INTERNA DE ESTA COLONIA PSIQUIATRICA "" DR. A. I. FREYRE""","PROD.MEDICINALES-PROD.QUIM.-INSUMOS P/ENV.MEDICINALES/PRODUCTOS MEDICINALES PARA USO HUMANO","PESOS","95256,73","COLONIA PSIQUIÁTRICA OLIVEROS","COLONIA PSIQUIÁTRICA OLIVEROS","31-05-2018 10:00 hs.","OFICINA DE COMPRAS - COLONIA PSIQUIATRICA "" DR. A. I. FREYRE"" - RUTA 11 KM 356.5 ZONA RURAL- OLIVEROS- CP2206","PESOS","PESOS OCHENTA ($  80,00)","000301/2018","https://www.santafe.gov.ar/gestionesdecompras/site/gestion.php?idGestion=121033&contar=1&solodocs=1","CONCLUIDA","18-07-2018 13:31 hs."
"LICITACIÓN PÚBLICA","Sin Modalidad","50",2018,"ADQUISICION DE EQUIPAMIENTO PARA INVESTIGACION CRIMINAL Y VEHICULOS CON DESTINO A LA SUBSECRETARIA DE ASUNTOS PENALES DEL MINISTERIO DE JUSTICIA Y DERECHOS HUMANOS","ADQUISICION DE EQUIPAMIENTO Y VEHICULOS","EQUIPOS Y ELEMENTOS DE SEGURIDAD Y PROTECCION/EQUIPOS Y ELEMENTOS DE SEGURIDAD Y PROTECCION|  EQUIPOS Y ACCESORIOS DE COMUNICACION/EQUIPOS Y ACCESORIOS DE COMUNICACION|  INFORMATICA/EQUIPOS E INSUMOS DE COMPUTACION|  EQUIP.MEDICO P/HOSPITALES Y CENTROS SANITARIOS/EQUIPOS, INSTRUMENTAL E INSUMOS MEDICOS|  EQUIP.MEDICO P/HOSPITALES Y CENTROS SANITARIOS/EQUIPOS-UTILES-INSUMOS PARA LABORATORIO","PESOS",71065000,"SUBSECRETARÍA DE CONTRATACIONES Y GESTIÓN DE BIENES","MINISTERIO JUSTICIA Y DERECHOS HUMANOS (DIR. GRAL ADM)","04-07-2018 11:00 hs.","SUBSECRETARIA DE CONTRATACIONES Y GESTION DE BIENES, MENDOZA 2905, SANTA FE, SANTA FE","PESOS","$ 28430","02001-0035810-8","https://www.santafe.gov.ar/gestionesdecompras/site/gestion.php?idGestion=121119&contar=1&solodocs=1","EN TRAMITE","04-07-2018 23:20 hs."
"LICITACIÓN PRIVADA","Sin Modalidad","50",2018,"ADQUISICION DE MATERIALES PARA TRABAJOS DE IMPRESION CON DESTINO A LA DIRECCION GENERAL DE REGISTRO CIVIL DEPENDIENTE DEL MINISTERIO DE JUSTICIA Y DERECHOS HUMANOS","ADQUISICION DE MATERIALES PARA TRABAJOS DE IMPRESION","PAPELES/PAPELES|  INSUMOS P/A.GRAFICAS-MATERIAL P/ENCUADERNAR/INSUMOS P/A.GRAFICAS-MATERIAL P/ENCUADERNAR","PESOS","250097,03","SUBSECRETARÍA DE CONTRATACIONES Y GESTIÓN DE BIENES","REGISTRO NACIONAL DE LAS PERSONAS","05-06-2018 10:00 hs.","SUBSECRETARIA DE CONTRATACIONES Y GESTION DE BIENES, MENDOZA 2905, SANTA FE, SANTA FE","PESOS","$ 100","02001-0036409-5","https://www.santafe.gov.ar/gestionesdecompras/site/gestion.php?idGestion=121048&contar=1&solodocs=1","CONCLUIDA","12-09-2018 00:00 hs."
"LICITACIÓN PRIVADA","Sin Modalidad","50",2018,"CENTRO DE PEDIDO: SUMINISTROS - ROLLOS PAPEL ","ROLLOS PAPEL","PRODUCTOS, ELEMENTOS DE LIMPIEZA E HIGIENE PERSONAL/ARTICULOS DE LIMPIEZA","PESOS",850000,"HOSPITAL CENTENARIO ROSARIO","HOSPITAL CENTENARIO ROSARIO","17-07-2018 10:30 hs.","OFICINA DE COMPRAS","PESOS","SON PESOS TRESCIENTOS CINCUENTA CON 0/100.- ($ 350.-)","2016/2018","https://www.santafe.gov.ar/gestionesdecompras/site/gestion.php?idGestion=121173&contar=1&solodocs=1","EN TRAMITE","17-07-2018 23:20 hs."
"LICITACIÓN PÚBLICA","Sin Modalidad","51",2018,"CONTRATACION DE UN SERVICIO DE ARCHIVO EXTERNO, GUARDA Y CUSTODIA DE DOCUMENTACION CON DESTINO A LA CAJA DE JUBILACIONES Y PENSIONES DE LA PROVINCIA DE SANTA FE - DELEGACION ROSARIO - DEPENDIENTE DEL MINISTERIO DE TRABAJO Y SEGURIDAD SOCIAL","SERVICIO DE ARCHIVO, GUARDA Y CUSTODIA DE DOCUMENTACION","OTROS SERVICIOS/SERVICIO DE CUSTODIA Y GESTION DE ARCHIVOS","PESOS","549571,52","SUBSECRETARÍA DE CONTRATACIONES Y GESTIÓN DE BIENES","CAJA DE JUBILACIONES Y PENSIONES DE LA PROVINCIA","18-06-2018 10:00 hs.","SUBSECRETARIA DE CONTRATACIONES Y GESTION DE BIENES, MENDOZA 2905, SANTA FE, SANTA FE","PESOS",,"15120-0128341-8","https://www.santafe.gov.ar/gestionesdecompras/site/gestion.php?idGestion=121064&contar=1&solodocs=1","EN TRAMITE","18-06-2018 23:20 hs."
"LICITACIÓN PRIVADA","Sin Modalidad","51",2018,"CONTRATACION DE UN SERVICIO DE LIMPIEZA CON DESTINO AL CENTRO OPERATIVO FORESTAL SANTA FE - VIVERO PROVINCIAL DEPENDIENTE DEL MINISTERIO DE LA PRODUCCION","CONTRATACION SERVICIO DE LIMPIEZA","SERVICIO DE MANTENIMIENTO, REPARACION Y LIMPIEZA/CONTROL DE PLAGAS Y DESECHOS","PESOS",100080,"SUBSECRETARÍA DE CONTRATACIONES Y GESTIÓN DE BIENES","MAGIC (DIR.GRAL.ADM.)","08-06-2018 11:00 hs.","SUBSECRETARIA DE CONTRATACIONES Y GESTION DE BIENES, MENDOZA 2905, SANTA FE, SANTA FE","PESOS",,"00701-0109111-7","https://www.santafe.gov.ar/gestionesdecompras/site/gestion.php?idGestion=121063&contar=1&solodocs=1","EN TRAMITE","08-06-2018 23:20 hs."
"LICITACIÓN PRIVADA","Sin Modalidad","51",2018,"CENTRO DE PEDIDO: SUMINISTROS - PAÑALES","PAÑALES","PRODUCTOS, ELEMENTOS DE LIMPIEZA E HIGIENE PERSONAL/ELEMENTOS DE HIGIENE PERSONAL","PESOS",250000,"HOSPITAL CENTENARIO ROSARIO","HOSPITAL CENTENARIO ROSARIO","18-07-2018 10:00 hs.","OFICINA DE COMPRAS","PESOS","SON PESOS CIEN CON 0/100.- ($ 100.-)","1773/2018","https://www.santafe.gov.ar/gestionesdecompras/site/gestion.php?idGestion=121177&contar=1&solodocs=1","EN TRAMITE","18-07-2018 23:20 hs."
"LICITACIÓN PÚBLICA","Sin Modalidad","52",2018,"CONTRATACION DE UN SERVICIO DE TRANSPORTE DE PASAJEROS CON DESTINO AL SERVICIO PENITENCIARIO DE LA PROVINCIA DEPENDIENTE DEL MINISTERIO DE SEGURIDAD","CONTRATACION DE UN SERVICIO DE TRANSPORTE DE PASAJEROS ","OTROS SERVICIOS/SERVICIO DE TRASLADO DE PERSONAS","PESOS",82162740,"SUBSECRETARÍA DE CONTRATACIONES Y GESTIÓN DE BIENES","MINISTERIO DE SEGURIDAD","23-07-2018 11:00 hs.","SUBSECRETARIA DE CONTRATACIONES Y GESTION DE BIENES, MENDOZA 2905, SANTA FE, SANTA FE","PESOS","$ 32900","00201-0189142-0","https://www.santafe.gov.ar/gestionesdecompras/site/gestion.php?idGestion=121104&contar=1&solodocs=1","EN TRAMITE","23-07-2018 23:20 hs."
"LICITACIÓN PRIVADA","Sin Modalidad","52",2018,"ADQUISICION DE PAPEL OBRA Y CARTULINA PARA LA IMPRESION DE LIBRETAS Y REGISTROS PARA EL AÑO LECTIVO 2019 CON DESTINO A LA SUBSECRETARIA DE COMUNICACION DEPENDIENTE DEL MINISTERIO DE EDUCACION","ADQUISICION DE PAPEL OBRA Y CARTULINA","PAPELES/PAPELES","PESOS","650339,9","SUBSECRETARÍA DE CONTRATACIONES Y GESTIÓN DE BIENES","MINISTERIO DE EDUCACIÓN (DIR.GRAL.ADM.)","15-06-2018 10:00 hs.","SUBSECRETARIA DE CONTRATACIONES Y GESTION DE BIENES, MENDOZA 2905, SANTA FE, SANTA FE","PESOS","$ 260","00401-0284555-6","https://www.santafe.gov.ar/gestionesdecompras/site/gestion.php?idGestion=121074&contar=1&solodocs=1","CONCLUIDA","03-09-2018 00:00 hs."
"LICITACIÓN PÚBLICA","Sin Modalidad","53",2018,"CONTRATACION DE UN SERVICIO DE LIMPIEZA CON DESTINO A LA SALA DE CINE EL CAIRO EN LA CIUDAD DE ROSARIO DEPENDIENTE DEL MINISTERIO DE INNOVACION Y CULTURA","CONTRATACION DE UN SERVICIO DE LIMPIEZA ","SERVICIO DE MANTENIMIENTO, REPARACION Y LIMPIEZA/CONTROL DE PLAGAS Y DESECHOS","PESOS",633744,"SUBSECRETARÍA DE CONTRATACIONES Y GESTIÓN DE BIENES","MINISTERIO DE INNOVACIÓN Y CULTURA","22-06-2018 10:00 hs.","SUBSECRETARIA DE CONTRATACIONES Y GESTION DE BIENES, MENDOZA 2905, SANTA FE, SANTA FE","PESOS","$ 260","00306-0006757-8","https://www.santafe.gov.ar/gestionesdecompras/site/gestion.php?idGestion=121081&contar=1&solodocs=1","EN TRAMITE","22-06-2018 23:20 hs."
"LICITACIÓN PRIVADA","Sin Modalidad","53",2018,"ADQUISICION DE TREINTA Y CINCO (35) COMPUTADORAS PERSONALES DE ESCRITORIO CON DESTINO A LA SUBSECRETARIA DE LOS DERECHOS DE LA NIÑEZ, ADOLESCENCIA Y FAMILIA DEPENDIENTE DEL MINISTERIO DE DESARROLLO SOCIAL","ADQUISICION DE COMPUTADORAS PERSONALES","INFORMATICA/EQUIPOS E INSUMOS DE COMPUTACION","PESOS","517399,75","SUBSECRETARÍA DE CONTRATACIONES Y GESTIÓN DE BIENES","MINISTERIO DE DESARROLLO SOCIAL","13-06-2018 11:00 hs.","SUBSECRETARIA DE CONTRATACIONES Y GESTION DE BIENES, MENDOZA 2905, SANTA FE, SANTA FE","PESOS",,"01501-0085478-9","https://www.santafe.gov.ar/gestionesdecompras/site/gestion.php?idGestion=121072&contar=1&solodocs=1","EN TRAMITE","13-06-2018 23:20 hs."
"LICITACIÓN PRIVADA","Sin Modalidad","53",2018,"CENTRO DE PEDIDO:  FARMACIA - MEDICACIÓN VORICONAZOL Y TIRAS REACTIVAS","VORICONAZOL Y TIRAS REACTIVAS","PROD.MEDICINALES-PROD.QUIM.-INSUMOS P/ENV.MEDICINALES/PRODUCTOS MEDICINALES PARA USO HUMANO","PESOS",750000,"HOSPITAL CENTENARIO ROSARIO","HOSPITAL CENTENARIO ROSARIO","13-07-2018 10:00 hs.","OFICINA DE COMPRAS","PESOS","SON PESOS TRESCIENTOS CON 0/100.- ($  300.-)","2050/2018","https://www.santafe.gov.ar/gestionesdecompras/site/gestion.php?idGestion=121174&contar=1&solodocs=1","EN TRAMITE","13-07-2018 23:20 hs."
"LICITACIÓN PÚBLICA","Sin Modalidad","54",2018,"CONTRATACION DE UN SERVICIO DE LIMPIEZA CON DESTINO AL SERVICIO DE CATASTRO E INFORMACION TERRITORIAL  REGIONAL ROSARIO DEPENDIENTE DEL MINISTERIO DE ECONOMIA","CONTRATACION DE UN SERVICIO DE LIMPIEZA ","SERVICIO DE MANTENIMIENTO, REPARACION Y LIMPIEZA/SERVICIO DE LIMPIEZA","PESOS",1219020,"SUBSECRETARÍA DE CONTRATACIONES Y GESTIÓN DE BIENES","SERVICIO DE CATASTRO E INFORMACIÓN TERRITORIAL","22-06-2018 11:00 hs.","SUBSECRETARIA DE CONTRATACIONES Y GESTION DE BIENES, MENDOZA 2905, SANTA FE, SANTA FE","PESOS","$ 490","00306-0006855-5","https://www.santafe.gov.ar/gestionesdecompras/site/gestion.php?idGestion=121082&contar=1&solodocs=1","EN TRAMITE","22-06-2018 23:20 hs."
"LICITACIÓN PRIVADA","Sin Modalidad","54",2018,"ADQUISICION DE EQUIPAMIENTO INFORMATICO CON DESTINO A LA DELEGACION REGIONAL VI - ROSARIO DEPENDIENTE DEL MINISTERIO DE EDUCACION","ADQUISICION DE EQUIPAMIENTO INFORMATICO","INFORMATICA/EQUIPOS E INSUMOS DE COMPUTACION","PESOS",554400,"SUBSECRETARÍA DE CONTRATACIONES Y GESTIÓN DE BIENES","MINISTERIO DE EDUCACIÓN (DIR.GRAL.ADM.)","02-07-2018 11:00 hs.","SUBSECRETARIA DE CONTRATACIONES Y GESTION DE BIENES, MENDOZA 2905, SANTA FE, SANTA FE","PESOS",,"00416-0183133-8","https://www.santafe.gov.ar/gestionesdecompras/site/gestion.php?idGestion=121137&contar=1&solodocs=1","EN TRAMITE","02-07-2018 23:20 hs."
"LICITACIÓN PRIVADA","Sin Modalidad","54",2018,"CTRO DE PEDIDO: FARMACIA: PEGVISOMANT","PEGVISOMANT 10 MG","PROD.MEDICINALES-PROD.QUIM.-INSUMOS P/ENV.MEDICINALES/PRODUCTOS MEDICINALES PARA USO HUMANO","PESOS",300000,"HOSPITAL CENTENARIO ROSARIO","HOSPITAL CENTENARIO ROSARIO","03-08-2018 10:00 hs.","OFICINA DE COMPRAS","PESOS","SON PESOS CIENTO VEINTE CON 00/100 ($ 120.-)","2281/2018","https://www.santafe.gov.ar/gestionesdecompras/site/gestion.php?idGestion=121258&contar=1&solodocs=1","EN TRAMITE","03-08-2018 23:20 hs."
"LICITACIÓN PÚBLICA","Convenio Marco","55",2018,"CELEBRACION DE UN CONVENIO MARCO PARA LA PROVISION Y COLOCACION DE CUBIERTAS CON DESTINO A LA ADMINISTRACION PUBLICA PROVINCIAL CENTRALIZADA, DESCENTRALIZADA Y EMPRESAS Y SOCIEDADES PUBLICAS DEL ESTADO","CELEBRACION DE UN CONVENIO MARCO PARA LA PROVISION Y COLOCACION DE CUBIERTAS","VEHICULOS-EMBARCACIONES-INSUMOS-REPUESTOS/EQUIPOS Y ACCESORIOS PARA VEHICULOS|  VEHICULOS-EMBARCACIONES-INSUMOS-REPUESTOS/REPUESTOS Y PARTES PARA VEHICULOS","PESOS",1,"SUBSECRETARÍA DE CONTRATACIONES Y GESTIÓN DE BIENES","SUBSECRETARÍA DE CONTRATACIONES Y GESTIÓN DE BIENES","26-06-2018 11:00 hs.","SUBSECRETARÍA DE CONTRATACIONES Y GESTIÓN DE BIENES, SITA EN CALLE MENDOZA 2905 - PRIMER PISO - DE LA CIUDAD DE SANTA FE","PESOS","$  0 -","00306-0009494-1","https://www.santafe.gov.ar/gestionesdecompras/site/gestion.php?idGestion=121091&contar=1&solodocs=1","EN TRAMITE","26-06-2018 23:20 hs."
"LICITACIÓN PRIVADA","Sin Modalidad","55",2018,"ADQUISICION DE DIEZ (10) UPS CON DESTINO A LA SECRETARIA DE TECNOLOGIAS PARA LA GESTION DEPENDIENTE DEL MINISTERIO DE GOBIERNO Y REFORMA DEL ESTADO","ADQUISICION DE UPS","ELECTRICIDAD - ILUMINACION/EQUIPOS E INSUMOS PARA LA PRODUCCION DE ENERGIA","PESOS",876000,"SUBSECRETARÍA DE CONTRATACIONES Y GESTIÓN DE BIENES","MINISTERIO DE GOBIERNO Y REFORMA DEL ESTADO (DIR. ADM.)","27-06-2018 10:00 hs.","SUBSECRETARIA DE CONTRATACIONES Y GESTION DE BIENES, MENDOZA 2905, SANTA FE, SANTA FE","PESOS","$ 360","00108-0009884-2","https://www.santafe.gov.ar/gestionesdecompras/site/gestion.php?idGestion=121117&contar=1&solodocs=1","EN TRAMITE","27-06-2018 23:20 hs."
"LICITACIÓN PRIVADA","Sin Modalidad","55",2018,"CTRO DE PEDIDO: FARMACIA- SORAFENIB","SORAFENIB 200 MG","PROD.MEDICINALES-PROD.QUIM.-INSUMOS P/ENV.MEDICINALES/PRODUCTOS MEDICINALES PARA USO HUMANO","PESOS",450000,"HOSPITAL CENTENARIO ROSARIO","HOSPITAL CENTENARIO ROSARIO","03-08-2018 10:30 hs.","OFICINA DE COMPRAS","PESOS","SON PESOS CIENTO OCHENTA CON 00/100 ($ 180.-)","2287/2018","https://www.santafe.gov.ar/gestionesdecompras/site/gestion.php?idGestion=121259&contar=1&solodocs=1","EN TRAMITE","03-08-2018 23:20 hs."
"LICITACIÓN PÚBLICA","Sin Modalidad","56",2018,"CONTRATACION DE UN SERVICIO DE LIMPIEZA CON DESTINO AL ESPACIO CULTURAL ""LA REDONDA ARTE Y VIDA COTIDIANA"" DEPENDIENTE DEL MINISTERIO DE INNOVACION Y CULTURA","CONTRATACION SERVICIO DE LIMPIEZA","SERVICIO DE MANTENIMIENTO, REPARACION Y LIMPIEZA/CONTROL DE PLAGAS Y DESECHOS","PESOS",2508000,"SUBSECRETARÍA DE CONTRATACIONES Y GESTIÓN DE BIENES","MINISTERIO DE INNOVACIÓN Y CULTURA","03-07-2018 11:00 hs.","SUBSECRETARIA DE CONTRATACIONES Y GESTION DE BIENES, MENDOZA 2905, SANTA FE, SANTA FE","PESOS","$ 1010","01201-0012510-5","https://www.santafe.gov.ar/gestionesdecompras/site/gestion.php?idGestion=121120&contar=1&solodocs=1","EN TRAMITE","03-07-2018 23:20 hs."
"LICITACIÓN PRIVADA","Sin Modalidad","56",2018,"ADQUISICION DE UNA (1) CAMIONETA CABINA DOBLE 4X4 CON DESTINO A LA SUBSECRETARIA DE DESARROLLO TERRITORIAL DEPENDIENTE DEL MINISTERIO DE DESARROLLO SOCIAL","ADQUISICION DE CAMIONETA","VEHICULOS-EMBARCACIONES-INSUMOS-REPUESTOS/VEHICULOS","PESOS",810000,"SUBSECRETARÍA DE CONTRATACIONES Y GESTIÓN DE BIENES","MINISTERIO DE DESARROLLO SOCIAL","27-06-2018 11:00 hs.","SUBSECRETARIA DE CONTRATACIONES Y GESTION DE BIENES, MENDOZA 2905, SANTA FE, SANTA FE","PESOS","$ 330","01501-0089077-0","https://www.santafe.gov.ar/gestionesdecompras/site/gestion.php?idGestion=121121&contar=1&solodocs=1","CONCLUIDA","30-08-2018 00:00 hs."
"LICITACIÓN PRIVADA","Sin Modalidad","56",2018,"CTRO DE PEDIDO: FARMACIA- GOLIMUMAB","GOLIMUMAB 50 MG/0.5 ML LAPICERA PRECARGADA","PROD.MEDICINALES-PROD.QUIM.-INSUMOS P/ENV.MEDICINALES/PRODUCTOS MEDICINALES PARA USO HUMANO","PESOS",150000,"HOSPITAL CENTENARIO ROSARIO","HOSPITAL CENTENARIO ROSARIO","03-08-2018 10:45 hs.","OFICINA DE COMPRAS","PESOS","SON PESOS SESENTA CON 00/100 ($ 60.-)","2288/2018","https://www.santafe.gov.ar/gestionesdecompras/site/gestion.php?idGestion=121262&contar=1&solodocs=1","CONCLUIDA","28-08-2018 16:11 hs."
"LICITACIÓN PÚBLICA","Sin Modalidad","57",2018,"PROVISION Y MONTAJE INICIAL DE SIETE (7) CONJUNTOS DE MODULOS BAJO EL SISTEMA ""ALEROS"" EN LAS CIUDADES DE SANTA FE Y VILLA GOBERNADOR GALVEZ CON DESTINO AL MINISTERIO DE INNOVACION Y CULTURA","PROVISION Y MONTAJE DE MODULOS ","VEHICULOS-EMBARCACIONES-INSUMOS-REPUESTOS/REPUESTOS Y PARTES PARA VEHICULOS","PESOS","28093739,59","SUBSECRETARÍA DE CONTRATACIONES Y GESTIÓN DE BIENES","MINISTERIO DE INNOVACIÓN Y CULTURA","03-07-2018 10:00 hs.","SUBSECRETARIA DE CONTRATACIONES Y GESTION DE BIENES, MENDOZA 2905, SANTA FE, SANTA FE","PESOS","$ 11300","01201-0012614-8","https://www.santafe.gov.ar/gestionesdecompras/site/gestion.php?idGestion=121116&contar=1&solodocs=1","EN TRAMITE","03-07-2018 23:20 hs."
"LICITACIÓN PRIVADA","Sin Modalidad","57",2018,"ADQUISICION DE VEINTE (20) COMPUTADORAS PERSONALES CON DESTINO AL MINISTERIO DE EDUCACION","ADQUISICION DE COMPUTADORAS PERSONALES","INFORMATICA/EQUIPOS E INSUMOS DE COMPUTACION","PESOS",490000,"SUBSECRETARÍA DE CONTRATACIONES Y GESTIÓN DE BIENES","MINISTERIO DE EDUCACIÓN (DIR.GRAL.ADM.)","28-06-2018 11:00 hs.","SUBSECRETARIA DE CONTRATACIONES Y GESTION DE BIENES, MENDOZA 2905, SANTA FE, SANTA FE","PESOS",,"00401-0272419-4","https://www.santafe.gov.ar/gestionesdecompras/site/gestion.php?idGestion=121130&contar=1&solodocs=1","EN TRAMITE","28-06-2018 23:20 hs."
"LICITACIÓN PRIVADA","Sin Modalidad","57",2018,"CTRO DE PEDIDO: FARMACIA - VALGANCICLOVIR","VALGANCICLOVIR 450 MG","PROD.MEDICINALES-PROD.QUIM.-INSUMOS P/ENV.MEDICINALES/PRODUCTOS MEDICINALES PARA USO HUMANO","PESOS",600000,"HOSPITAL CENTENARIO ROSARIO","HOSPITAL CENTENARIO ROSARIO","13-08-2018 10:00 hs.","OFICINA DE COMPRAS","PESOS","SON PESOS DOSCIENTOS CUARENTA CON 00/100 ($ 240.-)","2513/2018","https://www.santafe.gov.ar/gestionesdecompras/site/gestion.php?idGestion=121293&contar=1&solodocs=1","CONCLUIDA","30-08-2018 15:22 hs."
"LICITACIÓN PÚBLICA","Sin Modalidad","58",2018,"PROVISION E INSTALACION DE BICICLETEROS EN LAS CIUDADES DE SANTA FE Y ROSARIO CON DESTINO A LA SUBSECRETARIA DE INNOVACION PUBLICA DEPENDIENTE DEL MINISTERIO DE GOBIERNO Y REFORMA DEL ESTADO","PROV. INST. DE BICICLETEROS","EQUIPOS Y ELEMENTOS VARIOS/EQUIPOS VARIOS","PESOS",1800000,"SUBSECRETARÍA DE CONTRATACIONES Y GESTIÓN DE BIENES","MINISTERIO DE GOBIERNO Y REFORMA DEL ESTADO (DIR. ADM.)","24-07-2018 10:00 hs.","SUBSECRETARIA DE CONTRATACIONES Y GESTION DE BIENES, MENDOZA 2905, SANTA FE, SANTA FE","PESOS","$ 720","00101-0274639-3","https://www.santafe.gov.ar/gestionesdecompras/site/gestion.php?idGestion=121123&contar=1&solodocs=1","EN TRAMITE","24-07-2018 23:20 hs."
"LICITACIÓN PRIVADA","Sin Modalidad","58",2018,"ADQUISICION DE EQUIPAMIENTO INFORMATICO CON DESTINO A LA DELEGACION REGIONAL II - RECONQUISTA DEPENDIENTE DEL MINISTERIO DE EDUCACION","ADQUISICION DE EQUIPAMIENTO INFORMATICO","INFORMATICA/EQUIPOS E INSUMOS DE COMPUTACION","PESOS",462770,"SUBSECRETARÍA DE CONTRATACIONES Y GESTIÓN DE BIENES","MINISTERIO DE EDUCACIÓN (DIR.GRAL.ADM.)","02-07-2018 10:00 hs.","SUBSECRETARIA DE CONTRATACIONES Y GESTION DE BIENES, MENDOZA 2905, SANTA FE, SANTA FE","PESOS",,"00412-0018875-2","https://www.santafe.gov.ar/gestionesdecompras/site/gestion.php?idGestion=121138&contar=1&solodocs=1","EN TRAMITE","02-07-2018 23:20 hs."
"LICITACIÓN PRIVADA","Sin Modalidad","58",2018,"CTRO DE PEDIDO: FARMACIA -NATALIZUMAB","NATALIZUMAB 300 MG","PROD.MEDICINALES-PROD.QUIM.-INSUMOS P/ENV.MEDICINALES/PRODUCTOS MEDICINALES PARA USO HUMANO","PESOS",400000,"HOSPITAL CENTENARIO ROSARIO","HOSPITAL CENTENARIO ROSARIO","14-08-2018 10:00 hs.","OFICINA DE COMPRAS","PESOS","SON PESOS CIENTO SESENTA CON 00/100 ($ 160.-)","2531/2018","https://www.santafe.gov.ar/gestionesdecompras/site/gestion.php?idGestion=121294&contar=1&solodocs=1","CONCLUIDA","30-08-2018 14:35 hs."
"LICITACIÓN PÚBLICA","Sin Modalidad","59",2018,"CONTRATACION DE UN SERVICIO DE ALQUILER DE CINCO (5) MODULOS HABITACIONALES CON DESTINO A LA DIRECCION PROVINCIAL DE COORDINACION OPERATIVA DEPENDIENTE DEL MINISTERIO DE SEGURIDAD","CONTRATACION SERVICIO ALQUILER MODULOS HABITACIONALES","ALQUILERES/ALQUILER DE MAQUINARIAS Y EQUIPOS","PESOS",588000,"SUBSECRETARÍA DE CONTRATACIONES Y GESTIÓN DE BIENES","MINISTERIO DE SEGURIDAD|  SUBSECRETARÍA DE CONTRATACIONES Y GESTIÓN DE BIENES","13-07-2018 10:00 hs.","SUBSECRETARIA DE CONTRATACIONES Y GESTION DE BIENES, MENDOZA 2905, SANTA FE, SANTA FE","PESOS",,"00201-0180754-6","https://www.santafe.gov.ar/gestionesdecompras/site/gestion.php?idGestion=121151&contar=1&solodocs=1","CONCLUIDA","18-07-2018 00:00 hs."
"LICITACIÓN PRIVADA","Sin Modalidad","59",2018,"ADQUISICION DE LICENCIAS DE MICROSOFT WINDOWS CON DESTINO A LA DIRECCION PROVINCIAL DE AUTOSEGURO DE RIESGOS DEL TRABAJO DEPENDIENTE DEL MINISTERIO DE TRABAJO Y SEGURIDAD SOCIAL","ADQUISICION DE LICENCIAS DE MICROSOFT WINDOWS","INFORMATICA/EQUIPOS E INSUMOS DE COMPUTACION","PESOS",143559,"SUBSECRETARÍA DE CONTRATACIONES Y GESTIÓN DE BIENES","MINISTERIO DE TRABAJO Y SEGURIDAD SOCIAL|  SUBSECRETARÍA DE CONTRATACIONES Y GESTIÓN DE BIENES","04-07-2018 10:00 hs.","SUBSECRETARIA DE CONTRATACIONES Y GESTION DE BIENES, MENDOZA 2905, SANTA FE, SANTA FE","PESOS",,"01607-0012145-7","https://www.santafe.gov.ar/gestionesdecompras/site/gestion.php?idGestion=121144&contar=1&solodocs=1","CONCLUIDA","18-07-2018 00:00 hs."
"LICITACIÓN PRIVADA","Sin Modalidad","59",2018,"CTRO DE PEDIDO: FARMACIA- MACITENTAN","MACITENTAN 10 MG","PROD.MEDICINALES-PROD.QUIM.-INSUMOS P/ENV.MEDICINALES/PRODUCTOS MEDICINALES PARA USO HUMANO","PESOS",450000,"HOSPITAL CENTENARIO ROSARIO","HOSPITAL CENTENARIO ROSARIO","14-08-2018 10:30 hs.","OFICINA DE COMPRAS","PESOS","SON PESOS CIENTO OCHENTA CON 00/100 ($ 180.-)","2532/2018","https://www.santafe.gov.ar/gestionesdecompras/site/gestion.php?idGestion=121304&contar=1&solodocs=1","EN TRAMITE","14-08-2018 23:20 hs."
"LICITACIÓN PÚBLICA","Sin Modalidad","6",2018,"ADQUISICION DE INSUMOS RADIOLOGICOS EN LA QUE INCLUYA EL COMODATO DE 2 (DOS) PROCESADORAS DE PELICULAS (EN OPTIMAS CONDICIONES CON GARANTIA DE USO) DESTINADO AL SERVICIO DE DIAGNOSTICO POR IMAGENES DEL HOSPITAL J. B. ITURRASPE, PARA 6 (SEIS) MESES CON OPCION A PRORROGA POR UN PERIODO IGUAL. PACTESE 6 (SEIS) ENTREGAS MENSUALES IGUALES Y CONSECUTIVAS ",,"EQUIP.MEDICO P/HOSPITALES Y CENTROS SANITARIOS/EQUIPOS, REPUESTOS E INSUMOS DE RAYOS X","PESOS",1550000,"HOSPITAL J.B. ITURRASPE","HOSPITAL J.B. ITURRASPE","08-02-2018 10:00 hs.","HOSPITAL J B ITURRASPE - BV PELLEGRINI 3551 - 1° PISO, OFICINA DE COMPRAS Y SUMINISTROS","PESOS","$   216",,"https://www.santafe.gov.ar/gestionesdecompras/site/gestion.php?idGestion=120658&contar=1&solodocs=1","CONCLUIDA","12-03-2018 08:44 hs."
"LICITACIÓN PÚBLICA","Sin Modalidad","6",2018,"ADQUISICION DE CINCO MIL CIENTO CINCUENTA (5.150) PISTOLAS SEMIAUTOMATICAS Y OCHOCIENTAS (800) ESCOPETAS CON DESTINO AL SERVICIO PENITENCIARIO Y A LA POLICIA DE LA PROVINCIA DEPENDIENTES DEL MINISTERIO DE SEGURIDAD","ADQUISICION DE PISTOLAS Y ESCOPETAS","EQUIPOS E INSUMOS P/LAS FUERZAS DE SEGURIDAD/EQUIPOS E INSUMOS P/LAS FUERZAS DE SEGURIDAD","PESOS",86850000,"SUBSECRETARÍA DE CONTRATACIONES Y GESTIÓN DE BIENES","MINISTERIO DE SEGURIDAD","10-04-2018 11:00 hs.","SUBSECRETARIA DE CONTRATACIONES Y GESTION DE BIENES, MENDOZA 2905, SANTA FE, SANTA FE","PESOS","$ 34740","00201-0186395-5","https://www.santafe.gov.ar/gestionesdecompras/site/gestion.php?idGestion=120676&contar=1&solodocs=1","CONCLUIDA","13-08-2018 00:00 hs."
"LICITACIÓN PÚBLICA","Sin Modalidad","6",2018,"CTRO. DE PEDIDO: FARMACIA - INSUMOS HEMODINAMIA ","INSUMOS PARA HEMODINAMIA PARA 3 MESES. ","PROD.MEDICINALES-PROD.QUIM.-INSUMOS P/ENV.MEDICINALES/PRODUCTOS MEDICINALES PARA USO HUMANO","PESOS",6700000,"HOSPITAL CENTENARIO ROSARIO","HOSPITAL CENTENARIO ROSARIO","02-03-2018 10:00 hs.","OFICINA DE COMPRAS","PESOS","SON PESOS DOS MIL SEISCIENTOS OCHENTA CON 00/100    ( $ 2680.00) ","489/2018 ","https://www.santafe.gov.ar/gestionesdecompras/site/gestion.php?idGestion=120720&contar=1&solodocs=1","CONCLUIDA","24-04-2018 16:49 hs."
"LICITACIÓN PÚBLICA","Sin Modalidad","6",2018,"ADQUISICIÓN DE MATERIAL DESCARTABLE PARA EL SERVICIO DE FARMACIA.","ADQUISICIÓN DE MATERIAL DESCARTABLE PARA EL SERVICIO DE FARMACIA.","EQUIP.MEDICO P/HOSPITALES Y CENTROS SANITARIOS/MATERIAL DESCARTABLE","PESOS","13847049,15","HOSPITAL DR. JOSE MARÍA CULLEN","HOSPITAL DR. JOSE MARÍA CULLEN","15-03-2018 10:00 hs.","DIVISIÓN COMPRAS HOSPITAL DR. JOSÈ MARÌA CULLEN, AV. FREYRE Nº 2150, 1º PISO - CP 3.000 - SANTA FE","PESOS","$  5.539.-","477/2018","https://www.santafe.gov.ar/gestionesdecompras/site/gestion.php?idGestion=120739&contar=1&solodocs=1","EN TRAMITE","15-03-2018 23:20 hs."
