"LICITACIÓN PRIVADA","Sin Modalidad","3",2018,"ADQUISICIÓN DE EQUIPAMIENTO PARA DERMATOLOGÍA.","ADQUISICIÓN DE EQUIPAMIENTO PARA DERMATOLOGÍA CON DESTINO AL CEMAFE.","EQUIP.MEDICO P/HOSPITALES Y CENTROS SANITARIOS/EQUIPOS, INSTRUMENTAL E INSUMOS MEDICOS","PESOS",163500,"MINISTERIO DE SALUD (DIR.GRAL.ADM.)","CEMAFE - CENTRO ESPECIALIDADES MÉDICAS AMBULATORIAS SANTA FE","06-04-2018 10:00 hs.","MINISTERIO DE SALUD – DPTO DE COMPRAS JUNA DE GARAY 2880 – 3000 STA FE. TEL.: (0342) 4572360/61- – INTERNOS 3121 - 3122 CORREO ELECTRÓNICO: COMPRASALUDSTAFE@SANTAFE.GOV.AR SITIO WEB: WWW.SANTAFE.GOV.AR","PESOS","$  65,00","00501-0160757-6","https://www.santafe.gov.ar/gestionesdecompras/site/gestion.php?idGestion=120824&contar=1&solodocs=1","EN TRAMITE","06-04-2018 23:20 hs."
"LICITACIÓN PRIVADA","Sin Modalidad","3",2018,"PLIEGO DE BASES Y CONDICIONES PARA LA ADQUISICIÓN DE MEDICAMENTOS, ANTISÉPTICOS Y MATERIAL DESCARTABLE CON DESTINO AL S.A.M.CO VILLA GDOR GALVEZ","PLIEGO DE BASES Y CONDICIONES PARA LA ADQUISICIÓN DE MEDICAMENTOS, ANTISÉPTICOS Y MATERIAL DESCARTABLE CON DESTINO AL S.A.M.CO VILLA GDOR GALVEZ","PROD.MEDICINALES-PROD.QUIM.-INSUMOS P/ENV.MEDICINALES/PRODUCTOS MEDICINALES PARA USO HUMANO","PESOS",360000,"HOSPITAL DR. ANSELMO GAMEN - VILLA GOBERNADOR GALVEZ","HOSPITAL DR. ANSELMO GAMEN - VILLA GOBERNADOR GALVEZ","25-04-2018 13:15 hs.","OFICINA CONTABLE - SAMCO V. G. GÁLVEZ ","PESOS","$  100,-","0177/2018","https://www.santafe.gov.ar/gestionesdecompras/site/gestion.php?idGestion=120915&contar=1&solodocs=1","EN TRAMITE","25-04-2018 23:20 hs."
"LICITACIÓN PRIVADA","Sin Modalidad","3",2018,"MATERIAL DESCARTABLE",,"PROD.MEDICINALES-PROD.QUIM.-INSUMOS P/ENV.MEDICINALES/PRODUCTOS MEDICINALES PARA USO HUMANO","PESOS",458000,"HOSPITAL PROTOMÉDICO MANUEL RODRIGUEZ","HOSPITAL PROTOMÉDICO MANUEL RODRIGUEZ","10-05-2018 09:00 hs.",,"PESOS","($  183.00) PESOS CIENTO OCHENTA Y TRES ","5071","https://www.santafe.gov.ar/gestionesdecompras/site/gestion.php?idGestion=120934&contar=1&solodocs=1","CONCLUIDA","24-07-2018 09:38 hs."
"LICITACIÓN PRIVADA","Sin Modalidad","3",2018,"ADQUISICION DE INSUMOS PARA DIAGNOSTICOS POR IMAGENES","ADQUISICION DE INSUMOS PARA DIAGNOSTICOS POR IMAGENES","EQUIP.MEDICO P/HOSPITALES Y CENTROS SANITARIOS/EQUIPOS, REPUESTOS E INSUMOS DE RAYOS X","PESOS",615206,"HOSPITAL CENTRAL RECONQUISTA OLGA STUKY DE RIZZI","HOSPITAL CENTRAL RECONQUISTA OLGA STUKY DE RIZZI","18-05-2018 09:15 hs.","HOSPITAL CENTRAL RECONQUISTA OLGA STUKY DE RIZZI - HIPOLITO YRIGOYEN Nº 1580 - 1º PISO SECTOR COMPRAS","PESOS","$  246.-",,"https://www.santafe.gov.ar/gestionesdecompras/site/gestion.php?idGestion=120998&contar=1&solodocs=1","EN TRAMITE","18-05-2018 23:20 hs."
"LICITACIÓN PRIVADA","Sin Modalidad","3",2018,"OBJETO: ADQUISICIÓN DE DESCARTABLES  Y MEDICAMENTOS CON DESTINO AL SERVICIO DE FARMACIA DEL HOSPITAL SAN JORGE"," ADQUISICIÓN DE DESCARTABLES  Y MEDICAMENTOS CON DESTINO AL SERVICIO DE FARMACIA DEL HOSPITAL SAN JORGE","PROD.MEDICINALES-PROD.QUIM.-INSUMOS P/ENV.MEDICINALES/PRODUCTOS MEDICINALES PARA USO HUMANO","PESOS",750000,"HOSPITAL SAMCO DE SAN JORGE","HOSPITAL SAMCO DE SAN JORGE","23-05-2018 10:00 hs.","OFICINA DE COMPRAS HOSPITAL SAN JORGE","PESOS","$ 312 ","032018","https://www.santafe.gov.ar/gestionesdecompras/site/gestion.php?idGestion=121021&contar=1&solodocs=1","EN TRAMITE","23-05-2018 23:20 hs."
"LICITACIÓN PRIVADA","Sin Modalidad","3",2018,"ADQUISICIÓN DE AUTOANALIZADOR AUTOMÁTICO MULTIPARAMETRICO PARA QUÍMICA CLÍNICA Y UN ANALIZADOR PARA COAGULACIÓN. ","ADQUISICIÓN DE AUTOANALIZADOR AUTOMÁTICO MULTIPARAMETRICO PARA QUÍMICA CLÍNICA Y UN ANALIZADOR PARA COAGULACIÓN. ","EQUIP.MEDICO P/HOSPITALES Y CENTROS SANITARIOS/EQUIPOS-UTILES-INSUMOS PARA LABORATORIO","PESOS",600000,"HOSPITAL SAN CARLOS - CASILDA","HOSPITAL SAN CARLOS - CASILDA","08-06-2018 09:00 hs.","HOSPITAL PROV. ""SAN CARLOS"" - CASILDA - SERV. DE COMPRAS","PESOS","$  240,00.-","0000-002392-0","https://www.santafe.gov.ar/gestionesdecompras/site/gestion.php?idGestion=121051&contar=1&solodocs=1","CONCLUIDA","14-06-2018 09:00 hs."
"LICITACIÓN PRIVADA","Sin Modalidad","3",2018,"ADQUISICIÓN DE UN SERVOCUNA PARA EL SERIVIO DE PEDIATRÍA DEL HOSPITAL REGIONAL VERA",,"EQUIPOS Y ELEMENTOS VARIOS/EQUIPOS VARIOS","PESOS",150000,"HOSPITAL REGIONAL VERA","HOSPITAL REGIONAL VERA","13-06-2018 09:00 hs.","OFICINA DE COMPRAS","PESOS","$ 60",,"https://www.santafe.gov.ar/gestionesdecompras/site/gestion.php?idGestion=121080&contar=1&solodocs=1","EN TRAMITE","13-06-2018 23:20 hs."
"LICITACIÓN PRIVADA","Sin Modalidad","3",2018,"ADQUISICIÓN EQUIPOS INFORMATICOS DESTINADOS A REEMPLAZAR EQUIPOS OBSOLESCENTES EN DISTINTAS AREAS DEL ENRESS EN LA CIUDAD DE SANTA FE Y ROSARIO","ADQUISICIÓN EQUIPOS INFORMATICOS DESTINADOS A REEMPLAZAR EQUIPOS OBSOLESCENTES EN DISTINTAS AREAS DEL ENRESS EN LA CIUDAD DE SANTA FE Y ROSARIO","INFORMATICA/EQUIPOS E INSUMOS DE COMPUTACION","PESOS",920000,"ENTE REGULADOR DE SERVICIOS SANITARIOS","ENTE REGULADOR DE SERVICIOS SANITARIOS","26-06-2018 11:00 hs.","25 DE MAYO 1951 - GENRENCIA DE ADMINISTRACION ENRESS ","PESOS","$  370,00.-","16501-0023497-6","https://www.santafe.gov.ar/gestionesdecompras/site/gestion.php?idGestion=121106&contar=1&solodocs=1","CONCLUIDA","16-07-2018 10:26 hs."
"LICITACIÓN PRIVADA","Sin Modalidad","3",2018,"ADQUISICIÓN DE UN CONTADOR HEMATOLÓGICO PARA EL LABORATORIO DEL HOSPITAL DE CERES DE LA PROVINCIA DE SANTA FE.",,"EQUIP.MEDICO P/HOSPITALES Y CENTROS SANITARIOS/EQUIPOS-UTILES-INSUMOS PARA LABORATORIO","PESOS",260000,"HOSPITAL DE CERES","HOSPITAL DE CERES","17-07-2018 09:00 hs.","OFICINA DE ADMINISTRACIÓN DEL HOSPITAL DE CERES BV. ESPAÑA Y CHACABUCO DE LA CIUDAD DE CERES.","PESOS","$  100,00 (CIEN PESOS)",,"https://www.santafe.gov.ar/gestionesdecompras/site/gestion.php?idGestion=121129&contar=1&solodocs=1","CONCLUIDA","31-07-2018 10:55 hs."
"LICITACIÓN PRIVADA","Sin Modalidad","3",2018,"""EJECUCION DE LA PLATEA SOBRE INGRESO AL CENTRO DE SALUD -LIBERTAD- PERETENECIENTES AL NODO ROSARIO","EJECUCION DE LA PLATEA PARA FACILITAR EL ACCESO AL CENTRO DE SALUD, DEL EFECTOR QUE SE DETALLA EN CARATULA CON LA FINALIDAD DE MEJORAR LA ACCESIBILIDAD AL MISMO LOS DIAS DE GRANDES LLUVIAS, FACILITANDO DE ESTA MANERA EL ACCESOS AL MISMO DE LA POBLACION Y EL EQUIPO DE SALUD","CONSTRUCCIONES/OBRAS","PESOS","279769,5","HOSPITAL PROVINCIAL DE ROSARIO - APS","HOSPITAL PROVINCIAL DE ROSARIO - APS","11-07-2018 11:00 hs.","OFICINA DE COMPRAS Y SUMINISTROS APS - HOSPITAL PROVINCIAL DE ROSARIO - ALEM 1450 - ROSARIO (2000) - TEL/FAX (0341) 4721502","PESOS","$ 112 (PESOS CIENTO DOCE)","25/2018","https://www.santafe.gov.ar/gestionesdecompras/site/gestion.php?idGestion=121160&contar=1&solodocs=1","EN TRAMITE","11-07-2018 23:20 hs."
"CONTRATACIÓN DIRECTA","Sin Modalidad","3",2018,"ADQ. RESMAS CARTULINA Y PAPEL COMERCIAL",,"PAPELES/PAPELES","PESOS",48900,"INSTITUTO AUTÁRQUICO PROVINCIAL DE OBRA SOCIAL","INSTITUTO AUTÁRQUICO PROVINCIAL DE OBRA SOCIAL","29-01-2018 12:30 hs.","I.A.P.O.S. - DPTO. CONTRATACIONES - SAN MARTÍN 3145 - C.P. 3000 - SANTA FE","PESOS",,"15302-0013076-4","https://www.santafe.gov.ar/gestionesdecompras/site/gestion.php?idGestion=120667&contar=1&solodocs=1","EN TRAMITE","29-01-2018 23:20 hs."
"CONTRATACIÓN DIRECTA","Sin Modalidad","3",2018,"LECHE MATERNIZADA, SEMI-MATERNIZADA Y ALIMENTACIÓN PARENTERAL ",,"PROD.MEDICINALES-PROD.QUIM.-INSUMOS P/ENV.MEDICINALES/PRODUCTOS MEDICINALES PARA USO HUMANO","PESOS",72000,"HOSPITAL PROTOMÉDICO MANUEL RODRIGUEZ","HOSPITAL PROTOMÉDICO MANUEL RODRIGUEZ","13-03-2018 10:00 hs.",,"PESOS",,"5004","https://www.santafe.gov.ar/gestionesdecompras/site/gestion.php?idGestion=120779&contar=1&solodocs=1","CONCLUIDA","10-04-2018 12:08 hs."
"CONTRATACIÓN DIRECTA","Sin Modalidad","3",2018,"ADQUISICION, INSTALACION Y PUESTA EN FUNCIONAMIENTO DE CAMARAS DE SEGURIDAD  EN EL INMUEBLE DE CALLE SAN MARTÍN 125","ADQUISICION, INSTALACION Y PUESTA EN FUNCIONAMIENTO DE CAMARAS DE SEGURIDAD  EN EL INMUEBLE DE CALLE SAN MARTÍN 125","EQUIPOS Y ELEMENTOS VARIOS/EQUIPOS VARIOS","PESOS",82885,"TRIBUNAL DE CUENTAS","TRIBUNAL DE CUENTAS","21-05-2018 09:00 hs.","SAN JERÓNIMO 1850 ","PESOS",,"00901-0083345-7","https://www.santafe.gov.ar/gestionesdecompras/site/gestion.php?idGestion=121145&contar=1&solodocs=1","EN TRAMITE","21-06-2018 23:20 hs."
"CONTRATACIÓN DIRECTA","Sin Modalidad","3",2018,"ADQUISICIÓN DE SERVICIOS DE TRANSPORTE DE PASAJEROS PARA EL PROGRAMA PERIPLO COLECTIVO 2018 – PERÍODO VACACIONES DE INVIERNO",,"OTROS SERVICIOS/SERVICIO DE TRASLADO DE PERSONAS","PESOS","288909,8","MINISTERIO DE INFRAESTRUCTURA Y TRANSPORTE","MINISTERIO DE INFRAESTRUCTURA Y TRANSPORTE","02-07-2018 11:00 hs.","MONTEVIDEO 970 - ROSARIO","PESOS",,"01801-0049106-2","https://www.santafe.gov.ar/gestionesdecompras/site/gestion.php?idGestion=121159&contar=1&solodocs=1","CONCLUIDA","24-07-2018 09:14 hs."
"CONCURSO PRIVADO","Sin Modalidad","3",2018,"ADQUISICION DE MEDICAMENTOS CON DESTINO A LA FARMACIA INTERNA DE ESTA COLONIA PSIQUIATRICA DE OLIVEROS "" DR. A. I. FREYRE""","ADQUISICION DE MEDICAMENTOS CON DESTINO A LA FARMACIA INTERNA DE ESTA COLONIA PSIQUIATRICA DE OLIVEROS "" DR. A. I. FREYRE""","PROD.MEDICINALES-PROD.QUIM.-INSUMOS P/ENV.MEDICINALES/PRODUCTOS MEDICINALES PARA USO HUMANO","PESOS",157850,"COLONIA PSIQUIÁTRICA OLIVEROS","COLONIA PSIQUIÁTRICA OLIVEROS","04-04-2018 10:00 hs.","COLONIA PSIQUIATRICA DE OLIVEROS - OFICINA DE COMPRAS","PESOS","$  80,00",,"https://www.santafe.gov.ar/gestionesdecompras/site/gestion.php?idGestion=120828&contar=1&solodocs=1","CONCLUIDA","16-04-2018 11:07 hs."
"LICITACIÓN PÚBLICA","Sin Modalidad","30",2018,"ADQUISICION DE BOTAS Y GUANTES CON DESTINO A LA DIRECCION GENERAL DE BOMBEROS ZAPADORES DEPENDIENTE DE LA POLICIA DE LA PROVINCIA DEL MINISTERIO DE SEGURIDAD","ADQUISICION DE BOTAS Y GUANTES","INDUMENTARIA/UNIFORMES PARA BOMBEROS","PESOS",4582800,"SUBSECRETARÍA DE CONTRATACIONES Y GESTIÓN DE BIENES","MINISTERIO DE SEGURIDAD","08-05-2018 11:00 hs.","SUBSECRETARIA DE CONTRATACIONES Y GESTION DE BIENES, MENDOZA 2905, SANTA FE, SANTA FE","PESOS","$ 1840","00201-0188007-7","https://www.santafe.gov.ar/gestionesdecompras/site/gestion.php?idGestion=120921&contar=1&solodocs=1","CONCLUIDA","20-07-2018 00:00 hs."
"LICITACIÓN PRIVADA","Sin Modalidad","30",2018,"CTRO DE PEDIDO: FARMACIA- TACROLIMUS","TACROLIMUS","PROD.MEDICINALES-PROD.QUIM.-INSUMOS P/ENV.MEDICINALES/PRODUCTOS MEDICINALES PARA USO HUMANO","PESOS",125000,"HOSPITAL CENTENARIO ROSARIO","HOSPITAL CENTENARIO ROSARIO","19-04-2018 10:00 hs.","OFICINA DE COMPRAS","PESOS","SON PESOS CINCUENTA CON 00/100 ($ 50.-)","1070/2018","https://www.santafe.gov.ar/gestionesdecompras/site/gestion.php?idGestion=120887&contar=1&solodocs=1","CONCLUIDA","21-08-2018 19:19 hs."
"LICITACIÓN PRIVADA","Sin Modalidad","30",2018,"ADQUISICION DE UN (1) VEHICULO TIPO CAMION LIVIANO CON DESTINO A LA AGENCIA PROVINCIAL DE REGISTRO, ADMINISTRACION Y DESTINO DE BIENES Y DERECHOS PATRIMONIALES DEPENDIENTE DEL MINISTERIO DE JUSTICIA Y DERECHOS HUMANOS","ADQUISICION DE UN (1) VEHICULO TIPO CAMION LIVIANO","VEHICULOS-EMBARCACIONES-INSUMOS-REPUESTOS/VEHICULOS","PESOS",650000,"SUBSECRETARÍA DE CONTRATACIONES Y GESTIÓN DE BIENES","SUBSECRETARÍA DE CONTRATACIONES Y GESTIÓN DE BIENES|  MINISTERIO JUSTICIA Y DERECHOS HUMANOS (DIR. GRAL ADM)","03-05-2018 10:00 hs.","SUBSECRETARIA DE CONTRATACIONES Y GESTION DE BIENES, MENDOZA 2905, SANTA FE, SANTA FE","PESOS","$ 260","02001-0034999-3","https://www.santafe.gov.ar/gestionesdecompras/site/gestion.php?idGestion=120895&contar=1&solodocs=1","CONCLUIDA","23-05-2018 00:00 hs."
"LICITACIÓN PRIVADA","Sin Modalidad","30",2018,"ADQUISICIÓN DE MEDICAMENTOS DE ALTO COSTO PARA EL SERVICIO DE FARMACIA","ADQUISICIÓN DE MEDICAMENTOS DE ALTO COSTO PARA EL SERVICIO DE FARMACIA","PROD.MEDICINALES-PROD.QUIM.-INSUMOS P/ENV.MEDICINALES/PRODUCTOS MEDICINALES PARA USO HUMANO","PESOS",690000,"HOSPITAL DR. ALEJANDRO GUTIERREZ - VENADO TUERTO","HOSPITAL DR. ALEJANDRO GUTIERREZ - VENADO TUERTO","06-06-2018 09:00 hs.","COMPRAS","PESOS","$ 276 (PESOS DOSCIENTOS SETENTA Y SEIS) ",,"https://www.santafe.gov.ar/gestionesdecompras/site/gestion.php?idGestion=121078&contar=1&solodocs=1","EN TRAMITE","06-06-2018 23:20 hs."
"LICITACIÓN PRIVADA","Sin Modalidad","30",2018,"""ALQUILER DE 1 EQUIPO RESPIRADOR - 12 MESES - PACIENTE: OJEDA DALAN""","""ALQUILER DE 1 EQUIPO RESPIRADOR - 12 MESES - PACIENTE: OJEDA DALAN""","EQUIP.MEDICO P/HOSPITALES Y CENTROS SANITARIOS/EQUIPOS, INSTRUMENTAL E INSUMOS MEDICOS|  EQUIP.MEDICO P/HOSPITALES Y CENTROS SANITARIOS/EQUIPAMIENTO PARA REHABILITACION","PESOS",200000,"HOSPITAL DE NIÑOS DR. ORLANDO ALASSIA","HOSPITAL DE NIÑOS DR. ORLANDO ALASSIA","04-07-2018 10:00 hs.","OFICINA DE LICITACIONES  - HOSPITAL DE NIÑOS DR. O. ALASSIA","PESOS","$ 150,00 (SON PESOS CIENTO CINCUENTA CON 00/00)",,"https://www.santafe.gov.ar/gestionesdecompras/site/gestion.php?idGestion=121158&contar=1&solodocs=1","CONCLUIDA","13-07-2018 08:28 hs."
"LICITACIÓN PRIVADA","Sin Modalidad","30",2018,"ADQUISICION DE FORTIFICADORES DE LECHE MATERNA LIQUIDOS PARA 3 MESES CON 3 ENTREGAS",,"PROD.MEDICINALES-PROD.QUIM.-INSUMOS P/ENV.MEDICINALES/PRODUCTOS MEDICINALES PARA USO HUMANO|  PROD.MEDICINALES-PROD.QUIM.-INSUMOS P/ENV.MEDICINALES/PROD.MEDICINALES-PROD.QUIM.-INSUMOS P/ENV.MEDICINALES","PESOS",50000,"HOSPITAL J.B. ITURRASPE","HOSPITAL J.B. ITURRASPE","21-08-2018 10:00 hs.",,"PESOS","$   260","000-166","https://www.santafe.gov.ar/gestionesdecompras/site/gestion.php?idGestion=121282&contar=1&solodocs=1","EN TRAMITE","21-08-2018 23:20 hs."
"LICITACIÓN PÚBLICA","Sin Modalidad","31",2018,"ADQUISICION DE DOS (2) SISTEMAS DE TRANSMISION DE AUDIO Y VIDEO EN TIEMPO REAL CON DESTINO A LA SUBSECRETARIA DE INNOVACION PUBLICA DEPENDIENTE DEL MINISTERIO DE GOBIERNO Y REFORMA DEL ESTADO","ADQUISICION DE SISTEMAS DE TRANSMISION DE AUDIO Y VIDEO","EQUIPOS Y ACCESORIOS DE COMUNICACION/EQUIPOS Y ACCESORIOS DE COMUNICACION","PESOS",2310000,"SUBSECRETARÍA DE CONTRATACIONES Y GESTIÓN DE BIENES","MINISTERIO DE GOBIERNO Y REFORMA DEL ESTADO (DIR. ADM.)","22-05-2018 11:00 hs.","SUBSECRETARIA DE CONTRATACIONES Y GESTION DE BIENES, MENDOZA 2905, SANTA FE, SANTA FE","PESOS","$ 930","00101-0273355-1","https://www.santafe.gov.ar/gestionesdecompras/site/gestion.php?idGestion=120932&contar=1&solodocs=1","EN TRAMITE","22-05-2018 23:20 hs."
"LICITACIÓN PRIVADA","Sin Modalidad","31",2018,"ADQUISICION DE MATERIALES PARA TRABAJOS DE IMPRESION CON DESTINO A LA IMPRENTA OFICIAL DEPENDIENTE DEL MINISTERIO DE GOBIERNO Y REFORMA DEL ESTADO","ADQUISICION DE MATERIALES PARA IMPRESION","TELA/TELA|  LIBRERIA/ARTICULOS DE LIBRERIA|  PROD.MEDICINALES-PROD.QUIM.-INSUMOS P/ENV.MEDICINALES/PRODUCTOS QUIMICOS PARA LABORATORIO|  INSUMOS P/A.GRAFICAS-MATERIAL P/ENCUADERNAR/INSUMOS P/A.GRAFICAS-MATERIAL P/ENCUADERNAR|  REPUESTOS-ACCESORIOS EN GENERAL/REPUESTOS MAQUINAS P/LAS ARTES GRAFICAS","PESOS","971020,18","SUBSECRETARÍA DE CONTRATACIONES Y GESTIÓN DE BIENES","MINISTERIO DE GOBIERNO Y REFORMA DEL ESTADO (DIR. ADM.)","02-05-2018 10:00 hs.","SUBSECRETARIA DE CONTRATACIONES Y GESTION DE BIENES, MENDOZA 2905, SANTA FE, SANTA FE","PESOS","$ 390","00101-0274600-5","https://www.santafe.gov.ar/gestionesdecompras/site/gestion.php?idGestion=120905&contar=1&solodocs=1","CONCLUIDA","03-09-2018 00:00 hs."
"LICITACIÓN PRIVADA","Sin Modalidad","31",2018,"CTRO DE PEDIDO: LABORATORIO - INSUMOS PARA HEMOTERAPIA","INSUMOS PARA HEMOTERAPIA","PROD.MEDICINALES-PROD.QUIM.-INSUMOS P/ENV.MEDICINALES/PRODUCTOS MEDICINALES PARA USO HUMANO|  PROD.MEDICINALES-PROD.QUIM.-INSUMOS P/ENV.MEDICINALES/PRODUCTOS QUIMICOS EN GENERAL|  PROD.MEDICINALES-PROD.QUIM.-INSUMOS P/ENV.MEDICINALES/PROD.MEDICINALES-PROD.QUIM.-INSUMOS P/ENV.MEDICINALES","PESOS",800000,"HOSPITAL CENTENARIO ROSARIO","HOSPITAL CENTENARIO ROSARIO","03-05-2018 10:00 hs.","OFICINA DE COMPRAS","PESOS","SON PESOS TRESCIENTOS VEINTE CON 00/100 ($ 320.-)","1203/2018","https://www.santafe.gov.ar/gestionesdecompras/site/gestion.php?idGestion=120943&contar=1&solodocs=1","CONCLUIDA","30-08-2018 16:47 hs."
"LICITACIÓN PRIVADA","Sin Modalidad","31",2018,"ADQUISICIÓN DE LECHES PARA EL SERVICIO DE FARMACIA","ADQUISICIÓN DE LECHES PARA EL SERVICIO DE FARMACIA","PROD.MEDICINALES-PROD.QUIM.-INSUMOS P/ENV.MEDICINALES/PRODUCTOS MEDICINALES PARA USO HUMANO","PESOS",420000,"HOSPITAL DR. ALEJANDRO GUTIERREZ - VENADO TUERTO","HOSPITAL DR. ALEJANDRO GUTIERREZ - VENADO TUERTO","06-06-2018 10:00 hs.","COMPRAS","PESOS","$ 168 (PESOS CIENTO SESENTA Y OCHO)",,"https://www.santafe.gov.ar/gestionesdecompras/site/gestion.php?idGestion=121079&contar=1&solodocs=1","EN TRAMITE","06-06-2018 23:20 hs."
"LICITACIÓN PRIVADA","Sin Modalidad","31",2018,"""ADQUISICION DE FORMULAS LACTEAS II""","""ADQUISICION DE FORMULAS LACTEAS II""","PROD.MEDICINALES-PROD.QUIM.-INSUMOS P/ENV.MEDICINALES/PRODUCTOS MEDICINALES PARA USO HUMANO","PESOS",850000,"HOSPITAL DE NIÑOS DR. ORLANDO ALASSIA","HOSPITAL DE NIÑOS DR. ORLANDO ALASSIA","11-07-2018 10:00 hs.","OFICINA DE LICITACIONES - HOSPITAL DE NIÑOS DR. O. ALASSIA","PESOS","$  350,00 (SON PESOS TRESCIENTOS CINCUENTA)",,"https://www.santafe.gov.ar/gestionesdecompras/site/gestion.php?idGestion=121163&contar=1&solodocs=1","CONCLUIDA","26-07-2018 08:34 hs."
"LICITACIÓN PRIVADA","Sin Modalidad","31",2018,"ADQUISICION DE INSUMOS PARA EL SERVICIO DE COSTURERO. PARA TRES MESES Y CON TRES ENTREGAS",,"ARTICULOS DE BLANCO/ARTICULOS DE BLANCO","PESOS",50000,"HOSPITAL J.B. ITURRASPE","HOSPITAL J.B. ITURRASPE","17-09-2018 10:00 hs.","HOSPITAL J B ITURRASPE, BV PELLEGRINI 3551 - 1° PISO, OFICINA DE COMPRAS Y SUMINISTROS","PESOS","$  260",,"https://www.santafe.gov.ar/gestionesdecompras/site/gestion.php?idGestion=121400&contar=1&solodocs=1","PARA APERTURA","30-08-2018 09:05 hs."
"LICITACIÓN PÚBLICA","Orden de Compra Abierta","32",2018,"CONTRATACION DE UN SERVICIO DE RASTREO VEHICULAR SATELITAL CON DESTINO AL MINISTERIO DE INFRAESTRUCTURA Y TRANSPORTE","CONTRATACION SERVICIO DE RASTREO VEHICULAR","OTROS SERVICIOS/TRANSM.DATOS MOVILES Y SEGUIMIENTO SAT.","PESOS",900000,"SUBSECRETARÍA DE CONTRATACIONES Y GESTIÓN DE BIENES","MINISTERIO DE INFRAESTRUCTURA (DIR.GRAL ADM)","07-05-2018 10:00 hs.","SUBSECRETARIA DE CONTRATACIONES Y GESTION DE BIENES, MENDOZA 2905, SANTA FE, SANTA FE","PESOS","$ 360","01802-0015329-5","https://www.santafe.gov.ar/gestionesdecompras/site/gestion.php?idGestion=120917&contar=1&solodocs=1","CONCLUIDA","21-08-2018 00:00 hs."
"LICITACIÓN PRIVADA","Sin Modalidad","32",2018,"ADQUISICION DE EQUIPAMIENTO INFORMATICO CON DESTINO A LA AGENCIA DE CONTROL DE CANCER DEPENDIENTE DEL MINISTERIO DE SALUD","ADQUISICION DE EQUIPAMIENTO INFORMATICO","EQUIPOS Y ACCESORIOS DE COMUNICACION/EQUIPOS Y ACCESORIOS DE COMUNICACION|  INFORMATICA/EQUIPOS E INSUMOS DE COMPUTACION","PESOS",145120,"SUBSECRETARÍA DE CONTRATACIONES Y GESTIÓN DE BIENES","MINISTERIO DE SALUD (DIR.GRAL.ADM.)","26-04-2018 11:00 hs.","SUBSECRETARIA DE CONTRATACIONES Y GESTION DE BIENES, MENDOZA 2905, SANTA FE, SANTA FE","PESOS","$ 60","00501-0153758-7","https://www.santafe.gov.ar/gestionesdecompras/site/gestion.php?idGestion=120896&contar=1&solodocs=1","CONCLUIDA","21-08-2018 00:00 hs."
"LICITACIÓN PRIVADA","Sin Modalidad","32",2018,"CTRO DE PEDIDO: FARMACIA- SOLUCIONES PARENTERALES","SOLUCIONES PARENTERALES PARA SEIS MESES","PROD.MEDICINALES-PROD.QUIM.-INSUMOS P/ENV.MEDICINALES/PRODUCTOS MEDICINALES PARA USO HUMANO","PESOS",300000,"HOSPITAL CENTENARIO ROSARIO","HOSPITAL CENTENARIO ROSARIO","14-05-2018 10:00 hs.","OFICINA DE COMPRAS","PESOS","SON PESOS CIENTO VEINTE CON 00/100 ($ 120.-)","1310/2018","https://www.santafe.gov.ar/gestionesdecompras/site/gestion.php?idGestion=120976&contar=1&solodocs=1","CONCLUIDA","30-08-2018 16:53 hs."
"LICITACIÓN PRIVADA","Sin Modalidad","32",2018,"""ADQUISICION DE TOALLAS DESCARTABLES II""","""ADQUISICION DE TOALLAS DESCARTABLES II""","PRODUCTOS, ELEMENTOS DE LIMPIEZA E HIGIENE PERSONAL/ARTICULOS DE LIMPIEZA|  EQUIP.MEDICO P/HOSPITALES Y CENTROS SANITARIOS/MATERIAL DESCARTABLE","PESOS",450000,"HOSPITAL DE NIÑOS DR. ORLANDO ALASSIA","HOSPITAL DE NIÑOS DR. ORLANDO ALASSIA","06-07-2018 10:00 hs.","OFICINA DE LICITACIONES - HOSPITAL DE NIÑOS DR. O. ALASSIA","PESOS","$  180,00 (SON PESOS CIENTO OCHENTA CON 00/00)",,"https://www.santafe.gov.ar/gestionesdecompras/site/gestion.php?idGestion=121164&contar=1&solodocs=1","CONCLUIDA","26-07-2018 08:36 hs."
"LICITACIÓN PRIVADA","Sin Modalidad","32",2018,"ADQUISICION DE MATERIAL DESCARTABLE PARA EL SERVICIO DE ODONTOLOGIA",,"EQUIP.MEDICO P/HOSPITALES Y CENTROS SANITARIOS/EQUIPOS E INSUMOS ODONTOLOGICOS","PESOS",220000,"HOSPITAL DR. ALEJANDRO GUTIERREZ - VENADO TUERTO","HOSPITAL DR. ALEJANDRO GUTIERREZ - VENADO TUERTO","11-07-2018 09:00 hs.","OFICINA DE COMPRAS","PESOS","$ 88",,"https://www.santafe.gov.ar/gestionesdecompras/site/gestion.php?idGestion=121183&contar=1&solodocs=1","EN TRAMITE","11-07-2018 23:20 hs."
"LICITACIÓN PRIVADA","Sin Modalidad","32",2018,"COMODATO DE 24 FRASCOS CANISTER Y 12 CARROS POTA CANISTER, CON ADQUISICION DE BOLSAS RECEPTALES.",,"EQUIP.MEDICO P/HOSPITALES Y CENTROS SANITARIOS/EQUIPOS, INSTRUMENTAL E INSUMOS MEDICOS","PESOS",530000,"HOSPITAL J.B. ITURRASPE","HOSPITAL J.B. ITURRASPE","24-09-2018 10:00 hs.","HOSPITAL J B ITURRASPE. BV PELLEGRINI 3551 - 1° PISO. OFICINA DE COMPRAS Y SUMINISTROS","PESOS","$  260",,"https://www.santafe.gov.ar/gestionesdecompras/site/gestion.php?idGestion=121421&contar=1&solodocs=1","PARA APERTURA","04-09-2018 10:04 hs."
"LICITACIÓN PÚBLICA","Sin Modalidad","33",2018,"ADQUISICIÓN DE DOS (2) CAMIONES Y DOS (2) CAMILLAS DE AUXILIO CON DESTINO A LA POLICIA DE LA PROVINCIA DEPENDIENTE DEL MINISTERIO DE SEGURIDAD","ADQUISICIÓN DE DOS (2) CAMIONES Y DOS (2) CAMILLAS ","VEHICULOS-EMBARCACIONES-INSUMOS-REPUESTOS/VEHICULOS|  VEHICULOS-EMBARCACIONES-INSUMOS-REPUESTOS/REPUESTOS Y PARTES PARA VEHICULOS","PESOS",4180000,"SUBSECRETARÍA DE CONTRATACIONES Y GESTIÓN DE BIENES","MINISTERIO DE SEGURIDAD","21-05-2018 10:00 hs.","SUBSECRETARIA DE CONTRATACIONES Y GESTION DE BIENES, MENDOZA 2905, SANTA FE, SANTA FE","PESOS","$ 1680","00201-0185076-6","https://www.santafe.gov.ar/gestionesdecompras/site/gestion.php?idGestion=120961&contar=1&solodocs=1","CONCLUIDA","13-08-2018 00:00 hs."
"LICITACIÓN PRIVADA","Sin Modalidad","33",2018,"ADQUISICION DE TELEFONOS PARA LA RED DE TELEFONIA IP CON DESTINO A LAS REGIONALES SANTA FE Y ROSARIO DEL SERVICIO DE CATASTRO E INFORMACION TERRITORIAL DEPENDIENTE DEL MINISTERIO DE ECONOMIA","ADQUISICION DE TELEFONOS","EQUIPOS Y ACCESORIOS DE COMUNICACION/EQUIPOS Y ACCESORIOS DE COMUNICACION","PESOS",312840,"SUBSECRETARÍA DE CONTRATACIONES Y GESTIÓN DE BIENES","SERVICIO DE CATASTRO E INFORMACIÓN TERRITORIAL","27-04-2018 11:00 hs.","SUBSECRETARIA DE CONTRATACIONES Y GESTION DE BIENES, MENDOZA 2905, SANTA FE, SANTA FE","PESOS","$ 130","13401-1253882-2","https://www.santafe.gov.ar/gestionesdecompras/site/gestion.php?idGestion=120899&contar=1&solodocs=1","CONCLUIDA","27-08-2018 00:00 hs."
"LICITACIÓN PRIVADA","Sin Modalidad","33",2018,"CTRO DE PEDIDO: FARMACIA- ENZALUTAMIDA","ENZALUTAMIDA 40 MG ","PROD.MEDICINALES-PROD.QUIM.-INSUMOS P/ENV.MEDICINALES/PRODUCTOS MEDICINALES PARA USO HUMANO","PESOS",250000,"HOSPITAL CENTENARIO ROSARIO","HOSPITAL CENTENARIO ROSARIO","11-05-2018 10:00 hs.","OFICINA DE COMPRAS","PESOS","SON PESOS CIEN CON 00/100 ($ 100.-)","1311/2018","https://www.santafe.gov.ar/gestionesdecompras/site/gestion.php?idGestion=120977&contar=1&solodocs=1","CONCLUIDA","30-08-2018 16:58 hs."
"LICITACIÓN PRIVADA","Sin Modalidad","33",2018,"""ADQUISICION DE INSUMOS DESTINO ESTERILIZACION II""","""ADQUISICION DE INSUMOS DESTINO ESTERILIZACION II""","EQUIP.MEDICO P/HOSPITALES Y CENTROS SANITARIOS/MATERIAL DESCARTABLE","PESOS",900000,"HOSPITAL DE NIÑOS DR. ORLANDO ALASSIA","HOSPITAL DE NIÑOS DR. ORLANDO ALASSIA","11-07-2018 11:00 hs.","OFICINA DE LICITACIONES - HOSPITAL DE NIÑOS DR. O. ALASSIA","PESOS","$ 360,00 (SON PESOS TRESCIENTOS SESENTA CON 00/00)",,"https://www.santafe.gov.ar/gestionesdecompras/site/gestion.php?idGestion=121165&contar=1&solodocs=1","CONCLUIDA","26-07-2018 08:42 hs."
"LICITACIÓN PRIVADA","Sin Modalidad","33",2018,"ADQUISICIÓN DE MATERIAL DESCARTABLE ",,"EQUIP.MEDICO P/HOSPITALES Y CENTROS SANITARIOS/MATERIAL DESCARTABLE","PESOS",165000,"HOSPITAL DR. ALEJANDRO GUTIERREZ - VENADO TUERTO","HOSPITAL DR. ALEJANDRO GUTIERREZ - VENADO TUERTO","24-07-2018 09:00 hs.","OFICINA DE COMPRAS","PESOS","$ 66",,"https://www.santafe.gov.ar/gestionesdecompras/site/gestion.php?idGestion=121220&contar=1&solodocs=1","EN TRAMITE","24-07-2018 23:20 hs."
"LICITACIÓN PÚBLICA","Sin Modalidad","34",2018,"ADQUISICION DE DOS (2) VEHICULOS CON DESTINO A LA SECRETARIA DE PROTECCION CIVIL DEPENDIENTE DEL MINISTERIO DE GOBIERNO Y REFORMA DEL ESTADO","ADQUISICION DE VEHICULOS","VEHICULOS-EMBARCACIONES-INSUMOS-REPUESTOS/VEHICULOS","PESOS",1325000,"SUBSECRETARÍA DE CONTRATACIONES Y GESTIÓN DE BIENES","MINISTERIO DE GOBIERNO Y REFORMA DEL ESTADO (DIR. ADM.)","18-05-2018 10:00 hs.","SUBSECRETARIA DE CONTRATACIONES Y GESTION DE BIENES, MENDOZA 2905, SANTA FE, SANTA FE","PESOS","$ 530","00101-0274760-2","https://www.santafe.gov.ar/gestionesdecompras/site/gestion.php?idGestion=120953&contar=1&solodocs=1","CONCLUIDA","13-08-2018 00:00 hs."
