"LICITACIÓN PRIVADA","Sin Modalidad","18",2018,"""ADQUISICIÓN DE INSUMOS DESTINO GASES MEDICINALES""","""ADQUISICIÓN DE INSUMOS DESTINO GASES MEDICINALES""","GASES/GASES|  GASES/GASES MEDICINALES","PESOS",365000,"HOSPITAL DE NIÑOS DR. ORLANDO ALASSIA","HOSPITAL DE NIÑOS DR. ORLANDO ALASSIA","13-04-2018 10:00 hs.","OFICINA DE LICITACIONES - HOSPITAL DE NIÑOS DR O. ALASSIA","PESOS","$  150,00 (SON PESOS CIENTO CINCUENTA CON 00/00)",,"https://www.santafe.gov.ar/gestionesdecompras/site/gestion.php?idGestion=120863&contar=1&solodocs=1","CONCLUIDA","22-05-2018 08:12 hs."
"LICITACIÓN PRIVADA","Sin Modalidad","18",2018,"ADQUISICION DE BOLSAS DE RESIDUO Y TOALLAS PARA TRES MESES Y CON TRES ENTREGAS MENSUALES CONSECUTIVAS",,"ARTS. PLASTICOS-POLIETILENO-POLIPROPILENO-PVC/ELEM. POLIETILENO-POLIPROPILENO-PVC-NYLON|  PRODUCTOS, ELEMENTOS DE LIMPIEZA E HIGIENE PERSONAL/ELEMENTOS DE HIGIENE PERSONAL","PESOS",950000,"HOSPITAL J.B. ITURRASPE","HOSPITAL J.B. ITURRASPE","30-05-2018 10:00 hs.","HOSPITAL ITURRASPE - BV. PELLEGRINI 3551 - 1° PISO OFICINA DE COMPRAS Y SUMINISTROS","PESOS","$ 260","000-113","https://www.santafe.gov.ar/gestionesdecompras/site/gestion.php?idGestion=121016&contar=1&solodocs=1","CONCLUIDA","19-06-2018 09:52 hs."
"LICITACIÓN PRIVADA","Sin Modalidad","18",2018,"ADQUIRIR LECHES MATERNIZADAS PARA UN PERIODO DE 3 (TRES) MESES",,"PROD.MEDICINALES-PROD.QUIM.-INSUMOS P/ENV.MEDICINALES/PRODUCTOS MEDICINALES PARA USO HUMANO","PESOS",180000,"HOSPITAL PROVINCIAL DE ROSARIO","HOSPITAL PROVINCIAL DE ROSARIO","28-06-2018 10:00 hs.","HOSPITAL PROVINCIAL DE ROSARIO - OFICINA DE COMPRAS","PESOS","$ 100 (SON PESOS: CIEN)","1279/18","https://www.santafe.gov.ar/gestionesdecompras/site/gestion.php?idGestion=121125&contar=1&solodocs=1","CONCLUIDA","02-08-2018 10:02 hs."
"LICITACIÓN PRIVADA","Sin Modalidad","18",2018,"ADQUISICIÓN DE INSUMOS VARIOS PARA EL SERVICIO DE COSTURERO.-","ADQUISICIÓN DE INSUMOS VARIOS PARA EL SERVICIO DE COSTURERO.-","TELA/TELA|  ARTICULOS DE MERCERIA/ARTICULOS DE MERCERIA|  ARTS. PLASTICOS-POLIETILENO-POLIPROPILENO-PVC/ELEM. POLIETILENO-POLIPROPILENO-PVC-NYLON|  ARTICULOS DE BLANCO/ARTICULOS DE BLANCO","PESOS",361600,"HOSPITAL DR. JOSE MARÍA CULLEN","HOSPITAL DR. JOSE MARÍA CULLEN","12-07-2018 10:00 hs.","DIVISIÓN COMPRAS HOSPITAL DR. JOSÉ MARÍA CULLEN, AV. FREYRE Nº 2150,1º PISO - CP 3000 - SANTA FE","PESOS","$  145.-","1948/2018","https://www.santafe.gov.ar/gestionesdecompras/site/gestion.php?idGestion=121149&contar=1&solodocs=1","EN TRAMITE","12-07-2018 23:20 hs."
"LICITACIÓN PRIVADA","Sin Modalidad","18",2018,"BOLSAS DE HARINA ","ADQUISICIÓN DE 910 BOLSAS DE HARINA TIPO 000 DE 50 KG C/U","VIVERES/PANIFICACION","PESOS",500000,"INSTITUTO AUTÁRQUICO PROVINCIAL DE INDUSTRIAS PENITENCIARIAS","INSTITUTO AUTÁRQUICO PROVINCIAL DE INDUSTRIAS PENITENCIARIAS","27-08-2018 09:00 hs.","COMPRAS IAPIP","PESOS","200","12101-0004366-4","https://www.santafe.gov.ar/gestionesdecompras/site/gestion.php?idGestion=121364&contar=1&solodocs=1","EN TRAMITE","27-08-2018 23:20 hs."
"CONTRATACIÓN DIRECTA","Sin Modalidad","18",2018,"IMPRESIÓN Y PROVISIÓN DE BONOS ASISTENCIALES AMBULATORIOS.","IMPRESIÓN Y PROVISIÓN DE BONOS ASISTENCIALES AMBULATORIOS.","PAPELES/PAPELES|  SERVICIOS COMERCIALES Y FINANCIEROS/IMPRENTA, PUBLICACIONES, REPRODUCCIONES","PESOS",86820,"INSTITUTO AUTÁRQUICO PROVINCIAL DE OBRA SOCIAL","INSTITUTO AUTÁRQUICO PROVINCIAL DE OBRA SOCIAL","17-04-2018 12:00 hs.","I.A.P.O.S. CASA CENTRAL - DPTO. CONTRATACIONES - SAN MARTÍN 3145 - C.P. 3000 - SANTA FE","PESOS",,"15302-0013554-1","https://www.santafe.gov.ar/gestionesdecompras/site/gestion.php?idGestion=120886&contar=1&solodocs=1","EN TRAMITE","17-04-2018 23:20 hs."
"CONTRATACIÓN DIRECTA","Sin Modalidad","18",2018,"LECHE MATERNIZADA Y ALIMENTACIÓN ENTERAL",,"PROD.MEDICINALES-PROD.QUIM.-INSUMOS P/ENV.MEDICINALES/PRODUCTOS MEDICINALES PARA USO HUMANO","PESOS",78000,"HOSPITAL PROTOMÉDICO MANUEL RODRIGUEZ","HOSPITAL PROTOMÉDICO MANUEL RODRIGUEZ","10-09-2018 10:00 hs.",,"PESOS",,"5225","https://www.santafe.gov.ar/gestionesdecompras/site/gestion.php?idGestion=121425&contar=1&solodocs=1","EN TRAMITE","10-09-2018 23:20 hs."
"LICITACIÓN PÚBLICA","Sin Modalidad","19",2018,"ADQUISICION DE CINCO (5) CAMIONETAS CON DESTINO AL SERVICIO PENITENCIARIO DE LA PROVINCIA DEPENDIENTE DEL MINISTERIO DE SEGURIDAD","ADQUISICION DE CAMIONETAS ","VEHICULOS-EMBARCACIONES-INSUMOS-REPUESTOS/VEHICULOS","PESOS",4225000,"SUBSECRETARÍA DE CONTRATACIONES Y GESTIÓN DE BIENES","MINISTERIO DE SEGURIDAD","24-04-2018 11:00 hs.","SUBSECRETARIA DE CONTRATACIONES Y GESTION DE BIENES, MENDOZA 2905, SANTA FE, SANTA FE","PESOS","$ 1690","00205-0016938-2","https://www.santafe.gov.ar/gestionesdecompras/site/gestion.php?idGestion=120776&contar=1&solodocs=1","CONCLUIDA","13-08-2018 00:00 hs."
"LICITACIÓN PÚBLICA","Sin Modalidad","19",2018,"CENTRO DE PEDIDO: FARMACIA - INSUMOS HEMODINAMIA","INSUMOS HEMODINAMIA","PROD.MEDICINALES-PROD.QUIM.-INSUMOS P/ENV.MEDICINALES/PRODUCTOS MEDICINALES PARA USO HUMANO","PESOS",5800000,"HOSPITAL CENTENARIO ROSARIO","HOSPITAL CENTENARIO ROSARIO","06-07-2018 09:30 hs.","OFICINA DE COMPRAS","PESOS","SON PESOS DOS MIL CUATROCIENTOS CON 0/100 ($    2.400.-)","1791/2018","https://www.santafe.gov.ar/gestionesdecompras/site/gestion.php?idGestion=121113&contar=1&solodocs=1","CONCLUIDA","21-08-2018 15:14 hs."
"LICITACIÓN PÚBLICA","Sin Modalidad","19",2018,"ADQUISICIÓN DE 3 MAMOGRAFOS.","ADQUISICIÓN DE 3 MAMOGRAFOS CON DESTINO A LOS HOSPITALES DE FIRMAT, RAFAELA Y CASILDA.","EQUIP.MEDICO P/HOSPITALES Y CENTROS SANITARIOS/EQUIPOS, INSTRUMENTAL E INSUMOS MEDICOS|  EQUIP.MEDICO P/HOSPITALES Y CENTROS SANITARIOS/EQUIPOS, REPUESTOS E INSUMOS DE RAYOS X","DOLAR",195000,"MINISTERIO DE SALUD (DIR.GRAL.ADM.)","HOSPITAL SAN CARLOS - CASILDA|  HOSPITAL SAMCO DR. JAIME FERRÉ","03-09-2018 10:00 hs.","MINISTERIO DE SALUD – DPTO DE COMPRAS JUNA DE GARAY 2880 – 3000  STA FE. TEL.: (0342) 4572360/61- – INTERNOS 3121 - 3122 CORREO ELECTRÓNICO: COMPRASALUDSTAFE@SANTAFE.GOV.AR SITIO WEB: WWW.SANTAFE.GOV.AR","DOLAR","$  2.340,00","00501-0156883-1","https://www.santafe.gov.ar/gestionesdecompras/site/gestion.php?idGestion=121313&contar=1&solodocs=1","EN TRAMITE","03-09-2018 23:20 hs."
"LICITACIÓN PÚBLICA","Sin Modalidad","19",2018,"ADQUISICION DE MATERIAL DE CIRUGIA PARA TRES MESES Y CON TRES ENTREGAS","LICITACION PUBLICA Nº 19/18","EQUIP.MEDICO P/HOSPITALES Y CENTROS SANITARIOS/EQUIPOS, INSTRUMENTAL E INSUMOS MEDICOS","PESOS",4200000,"HOSPITAL J.B. ITURRASPE","HOSPITAL J.B. ITURRASPE","11-09-2018 10:00 hs.","HOSPITAL J.B. ITURRASPE - BV. PELLEGRINI 3551 1º PISO - OFICINA DE COMPRAS - SANTA FE - 3000","PESOS","$  1.680","000155/18","https://www.santafe.gov.ar/gestionesdecompras/site/gestion.php?idGestion=121409&contar=1&solodocs=1","EN TRAMITE","11-09-2018 23:20 hs."
"LICITACIÓN PRIVADA","Sin Modalidad","19",2018,"CTRO DE PEDIDO: FARMACIA- MEDICACIÓN ONCOLÓGICA","MEDICACIÓN ONCOLÓGICA: FULVESTRANT, SUNITINIB, PEMETREXED","PROD.MEDICINALES-PROD.QUIM.-INSUMOS P/ENV.MEDICINALES/PRODUCTOS MEDICINALES PARA USO HUMANO","PESOS",450000,"HOSPITAL CENTENARIO ROSARIO","HOSPITAL CENTENARIO ROSARIO","08-02-2018 11:00 hs.","OFICINA DE COMPRAS","PESOS","SON PESOS CIENTO OCHENTA CON 00/100 ($ 180.-)","406/2018","https://www.santafe.gov.ar/gestionesdecompras/site/gestion.php?idGestion=120685&contar=1&solodocs=1","CONCLUIDA","28-08-2018 17:48 hs."
"LICITACIÓN PRIVADA","Sin Modalidad","19",2018,"PROVISION, INSTALACION Y PUESTA EN FUNCIONAMIENTO DE UN SISTEMA DE CABLEADO DE COMUNICACION DE DATOS CON DESTINO A LA POLICIA DE INVESTIGACIONES EN LA CIUDAD DE ROSARIO DEPENDIENTE DE LA POLICIA DE LA PROVINCIA DEL MINISTERIO DE SEGURIDAD","PROV., INST. Y P. EN FUNC. DE UN SISTEMA DE CABLEADO","INFORMATICA/EQUIPOS E INSUMOS DE COMPUTACION|  OTROS SERVICIOS/TRANSMISION DE DATOS","PESOS",542920,"SUBSECRETARÍA DE CONTRATACIONES Y GESTIÓN DE BIENES","MINISTERIO DE SEGURIDAD","14-03-2018 10:00 hs.","SUBSECRETARIA DE CONTRATACIONES Y GESTION DE BIENES, MENDOZA 2905, SANTA FE, SANTA FE","PESOS","$ 220","00215-0004829-7","https://www.santafe.gov.ar/gestionesdecompras/site/gestion.php?idGestion=120752&contar=1&solodocs=1","CONCLUIDA","23-05-2018 00:00 hs."
"LICITACIÓN PRIVADA","Sin Modalidad","19",2018,"""ADQUISICION DE INSUMOS DESTINO NEUROCIRUGIA I""","""ADQUISICION DE INSUMOS DESTINO NEUROCIRUGIA I""","EQUIP.MEDICO P/HOSPITALES Y CENTROS SANITARIOS/MATERIAL DESCARTABLE|  EQUIP.MEDICO P/HOSPITALES Y CENTROS SANITARIOS/NEUROCIRUGIA","PESOS",1000000,"HOSPITAL DE NIÑOS DR. ORLANDO ALASSIA","HOSPITAL DE NIÑOS DR. ORLANDO ALASSIA","20-04-2018 10:00 hs.","OFICINA DE LICITACIONES - HOSPITAL DE NIÑOS DR. O. ALASSIA","PESOS","$  400,00 (SON PESOS CUATROCIENTOS CON 00/00)",,"https://www.santafe.gov.ar/gestionesdecompras/site/gestion.php?idGestion=120891&contar=1&solodocs=1","CONCLUIDA","22-05-2018 08:19 hs."
"LICITACIÓN PRIVADA","Sin Modalidad","19",2018,"ADQUISICION DE PAÑALES PARA P.I.S","ADQUISICION DE PAÑALES","EQUIP.MEDICO P/HOSPITALES Y CENTROS SANITARIOS/MATERIAL DESCARTABLE","PESOS",220000,"HOSPITAL DR. ALEJANDRO GUTIERREZ - VENADO TUERTO","HOSPITAL DR. ALEJANDRO GUTIERREZ - VENADO TUERTO","27-04-2018 09:00 hs.","OFICINA DE COMPRAS","PESOS","$ 88",,"https://www.santafe.gov.ar/gestionesdecompras/site/gestion.php?idGestion=120923&contar=1&solodocs=1","EN TRAMITE","27-04-2018 23:20 hs."
"LICITACIÓN PRIVADA","Sin Modalidad","19",2018,"ADQUISICION DE ARTICULOS DE LIBRERIA PARA TRES MESES CON TRES ENTREGAS MENSUALES CONSECUTIVAS",,"LIBRERIA/ARTICULOS DE LIBRERIA","PESOS",295000,"HOSPITAL J.B. ITURRASPE","HOSPITAL J.B. ITURRASPE","05-06-2018 10:00 hs.","HOSPITAL J. B. ITURRASPE -BV. PELLEGRINI 3551 - 1° PISO OFICINA DE COMPRAS Y SUMINISTROS","PESOS","$  260,00","000-114","https://www.santafe.gov.ar/gestionesdecompras/site/gestion.php?idGestion=121018&contar=1&solodocs=1","CONCLUIDA","03-08-2018 10:03 hs."
"LICITACIÓN PRIVADA","Sin Modalidad","19",2018,"ADQUIRIR MEDICAMENTOS PARA PACIENTES RENALES PARA UN PERIODO DE 3 (TRES) MESES",,"PROD.MEDICINALES-PROD.QUIM.-INSUMOS P/ENV.MEDICINALES/PRODUCTOS MEDICINALES PARA USO HUMANO","PESOS",260000,"HOSPITAL PROVINCIAL DE ROSARIO","HOSPITAL PROVINCIAL DE ROSARIO","26-06-2018 10:00 hs.","HOSPITAL PROVINCIAL DE ROSARIO - OFICINA DE COMPRAS","PESOS","$ 104 (SON PESOS: CIENTO CUATRO)","1298/18","https://www.santafe.gov.ar/gestionesdecompras/site/gestion.php?idGestion=121124&contar=1&solodocs=1","CONCLUIDA","02-08-2018 10:02 hs."
"LICITACIÓN PRIVADA","Sin Modalidad","19",2018,"ADQUISICIÓN DE EQUIPAMIENTO PARA EL NUEVO SERVICIO DE MATERNIDAD CENTRAL.","ADQUISICIÓN DE EQUIPAMIENTO PARA EL NUEVO SERVICIO DE MATERNIDAD CENTRAL.","EQUIP.MEDICO P/HOSPITALES Y CENTROS SANITARIOS/EQUIPOS, INSTRUMENTAL E INSUMOS MEDICOS","PESOS","423603,32","HOSPITAL DR. JOSE MARÍA CULLEN","HOSPITAL DR. JOSE MARÍA CULLEN","16-07-2018 10:00 hs.","DIVISIÓN COMPRAS HOSPITAL DR. JOSÉ MARÍA CULLEN, AV. FREYRE Nº 2150, 1º PISO - CP. 3000 - SANTA FE","PESOS","$  170.-","1999/2018","https://www.santafe.gov.ar/gestionesdecompras/site/gestion.php?idGestion=121150&contar=1&solodocs=1","EN TRAMITE","16-07-2018 23:20 hs."
"LICITACIÓN PRIVADA","Sin Modalidad","19",2018,"HIERROS,CAÑOS Y MALLAS","HIERROS,CAÑOS Y MALLAS","MATERIALES PARA LA CONSTRUCCION/HIERRO","PESOS","372563,05","INSTITUTO AUTÁRQUICO PROVINCIAL DE INDUSTRIAS PENITENCIARIAS","INSTITUTO AUTÁRQUICO PROVINCIAL DE INDUSTRIAS PENITENCIARIAS","11-09-2018 09:00 hs.","IAPIP-BELGRANO 2421 - CORONDA - SANTA FE","PESOS","160","12101-0004369-7","https://www.santafe.gov.ar/gestionesdecompras/site/gestion.php?idGestion=121384&contar=1&solodocs=1","EN TRAMITE","11-09-2018 23:20 hs."
"CONTRATACIÓN DIRECTA","Sin Modalidad","19",2018,"CONTRATACIÓN DE UN SERV. DE ÁREA PROTEGIDA, DE EMERGENCIAS Y URGENCIAS, PARA EMPLEADOS, AFILIADOS PRESENTES, PROVEEDORES Y/O PERSONAS EN GENERAL QUE SE ENCUENTREN OCASIONALMENTE EN EL INMUEBLE DE I.A.P.O.S. UBICADO EN RIOJA 2051 - CIUDAD DE ROSARIO.",,"SERVICIOS TECNICOS Y PROFESIONALES/SERVICIOS MEDICOS|  OTROS SERVICIOS/SERVICIOS MEDICOS","PESOS",15318,"INSTITUTO AUTÁRQUICO PROVINCIAL DE OBRA SOCIAL","INSTITUTO AUTÁRQUICO PROVINCIAL DE OBRA SOCIAL","27-04-2018 13:00 hs.","I.A.P.O.S. - DPTO. CONTRATACIONES - SAN MARTÍN 3145 - C.P. 3000 - SANTA FE ","PESOS",,"15302-0013538-9","https://www.santafe.gov.ar/gestionesdecompras/site/gestion.php?idGestion=120931&contar=1&solodocs=1","EN TRAMITE","27-04-2018 23:20 hs."
"CONTRATACIÓN DIRECTA","Sin Modalidad","19",2018,"REACTIVOS DE LABORATORIO",,"PROD.MEDICINALES-PROD.QUIM.-INSUMOS P/ENV.MEDICINALES/PRODUCTOS QUIMICOS PARA LABORATORIO","PESOS",48000,"HOSPITAL PROTOMÉDICO MANUEL RODRIGUEZ","HOSPITAL PROTOMÉDICO MANUEL RODRIGUEZ","13-09-2018 10:00 hs.",,"PESOS",,"5226","https://www.santafe.gov.ar/gestionesdecompras/site/gestion.php?idGestion=121426&contar=1&solodocs=1","PARA APERTURA","04-09-2018 13:07 hs."
"CONCURSO PÚBLICO","Sin Modalidad","2",2018,"CONTRATACION DEL DICTADO DE TALLERES TEORICO - PRACTICO DE CAPACITACION DE INSTALACION DE SISTEMAS SOLARES FOTOVOLTAICOS DE BAJA POTENCIA A DICTARSE EN VEINTE (20) LOCALIDADES DE LA PROVINCIA DEPENDIENTE DE LA SECRETARIA DE ESTADO DE LA ENERGIA","CONTRATACION DICTADO TALLERES DE CAPACITACION","PROV. INST. Y PUESTA EN FUNCIONAMIENTO/PROV. INST. Y PUESTA EN FUNCIONAMIENTO|  SERVICIOS TECNICOS Y PROFESIONALES/CONTRATACION DE SERVICIOS PROFESIONALES","PESOS",2819000,"SUBSECRETARÍA DE CONTRATACIONES Y GESTIÓN DE BIENES","SECRETARIA DE ESTADO DE LA ENERGÍA","24-08-2018 10:00 hs.","SUBSECRETARIA DE CONTRATACIONES Y GESTION DE BIENES, MENDOZA 2905, SANTA FE, SANTA FE","PESOS","$ 1130","02401-0003517-3","https://www.santafe.gov.ar/gestionesdecompras/site/gestion.php?idGestion=121295&contar=1&solodocs=1","EN TRAMITE","24-08-2018 23:20 hs."
"CONCURSO DE PRECIOS","Sin Modalidad","2",2018,"REFACCION EN BAÑOS DE PLANTA BAJA Y SEGUNDO PISO, PARA LA PUESTA EN VALOR EDIFICIO SEDE DEL TRIBUNAL DE CUENTAS DE LA PROVINCIA","REFACCION EN BAÑOS DE PLANTA BAJA Y SEGUNDO PISO, PARA LA PUESTA EN VALOR EDIFICIO SEDE DEL TRIBUNAL DE CUENTAS DE LA PROVINCIA","CONSTRUCCIONES/OBRAS","PESOS",127703,"TRIBUNAL DE CUENTAS","TRIBUNAL DE CUENTAS","08-05-2018 10:00 hs.","SAN JERÓNIMO 1850 - D.G.A. - COORDINACIÓN DE SERVICIOS CENTRALES Y CONTRATACIONES","PESOS","$  150","00901-0083972-7","https://www.santafe.gov.ar/gestionesdecompras/site/gestion.php?idGestion=120960&contar=1&solodocs=1","EN TRAMITE","08-05-2018 23:20 hs."
"LICITACIÓN PÚBLICA","Sin Modalidad","2",2018,"CTRO DE PEDIDO: COORDINACIÓN DE OBRAS- REGULARIZACIÓN GAS NATURAL   VISITA DE OBRA: 16/01/2018   10:00 HS","REGULARIZACIÓN DE INSTALACIÓN DE GAS NATURAL","CONSTRUCCIONES/CONSTRUCCIONES CIVILES","PESOS",4500000,"HOSPITAL CENTENARIO ROSARIO","HOSPITAL CENTENARIO ROSARIO","25-01-2018 10:00 hs.","CONSEJO DE ADMINISTRACIÓN ","PESOS","SON PESOS UN MIL OCHOCIENTOS CON 00/100 ($ 1800.-)","3998/2017","https://www.santafe.gov.ar/gestionesdecompras/site/gestion.php?idGestion=120583&contar=1&solodocs=1","CONCLUIDA","16-03-2018 17:32 hs."
"LICITACIÓN PÚBLICA","Sin Modalidad","2",2018,"CONTRATACION DE UN SERVICIO DE COBERTURA MEDICA PARA LA DELEGACION VI Y ESTABLECIMIENTOS EDUCATIVOS OFICIALES EN LAS CIUDADES DE ROSARIO Y VILLA GOBERNADOR GALVEZ, CON DESTINO AL MINISTERIO DE EDUCACION","CONTRATACION SERVICIO DE COBERTURA MEDICA","SERVICIOS TECNICOS Y PROFESIONALES/SERVICIOS MEDICOS","PESOS",7800000,"SUBSECRETARÍA DE CONTRATACIONES Y GESTIÓN DE BIENES","MINISTERIO DE EDUCACIÓN (DIR.GRAL.ADM.)","29-01-2018 10:00 hs.","SUBSECRETARIA DE CONTRATACIONES Y GESTION DE BIENES, MENDOZA 2905, SANTA FE, SANTA FE","PESOS","$ 3120","00416-0186569-0","https://www.santafe.gov.ar/gestionesdecompras/site/gestion.php?idGestion=120606&contar=1&solodocs=1","EN TRAMITE","29-01-2018 23:20 hs."
"LICITACIÓN PÚBLICA","Sin Modalidad","2",2018,"ADQUISICIÓN DE INSUMOS VARIOS PARA EL SERVICIO DE HEMODINAMIA.","ADQUISICIÓN DE INSUMOS VARIOS PARA EL SERVICIO DE HEMODINAMIA.","EQUIP.MEDICO P/HOSPITALES Y CENTROS SANITARIOS/EQUIPOS, INSTRUMENTAL E INSUMOS MEDICOS|  EQUIP.MEDICO P/HOSPITALES Y CENTROS SANITARIOS/MATERIAL DESCARTABLE","PESOS","1329156,31","HOSPITAL DR. JOSE MARÍA CULLEN","HOSPITAL DR. JOSE MARÍA CULLEN","02-02-2018 10:00 hs.","ADQUISICIÓN DE INSUMOS VARIOS PARA EL SERVICIO DE HEMODINAMIA.","PESOS","$   532,00.-","3694/2017","https://www.santafe.gov.ar/gestionesdecompras/site/gestion.php?idGestion=120636&contar=1&solodocs=1","EN TRAMITE","02-02-2018 23:20 hs."
"LICITACIÓN PÚBLICA","Sin Modalidad","2",2018,"SOLICITUD DE INSUMOS PARA EL SERVICIO DE MICROBIOLOGIA","LICITACION PUBLICA PARA LA SOLICITUD DE INSUMOS PARA EL SERVICIO DE MICROBIOLOGIA","PROD.MEDICINALES-PROD.QUIM.-INSUMOS P/ENV.MEDICINALES/PRODUCTOS MEDICINALES PARA USO HUMANO","PESOS","1974833,06","HOSPITAL ESCUELA EVA PERÓN","HOSPITAL ESCUELA EVA PERÓN","30-01-2018 10:00 hs.","HOSPITAL ESCUELA EVA PERON - AV, SAN MARTIN 1645 - 2152 GRANADERO BAIGORRIA - OFICINA DE COMPRAS","PESOS","$  789,94 PESOS: SETECIENTOS OCHENTA Y NUEVE C/94/00 ....................................................","24476","https://www.santafe.gov.ar/gestionesdecompras/site/gestion.php?idGestion=120642&contar=1&solodocs=1","CONCLUIDA","23-04-2018 11:39 hs."
"LICITACIÓN PÚBLICA","Sin Modalidad","2",2018,"ADQUISICION DE MATERIAL DESCARTABLE",,"EQUIP.MEDICO P/HOSPITALES Y CENTROS SANITARIOS/MATERIAL DESCARTABLE","PESOS",3012500,"HOSPITAL DR. ALEJANDRO GUTIERREZ - VENADO TUERTO","HOSPITAL DR. ALEJANDRO GUTIERREZ - VENADO TUERTO","19-02-2018 09:00 hs.","OFICINA DE COMPRAS","PESOS","1205",,"https://www.santafe.gov.ar/gestionesdecompras/site/gestion.php?idGestion=120679&contar=1&solodocs=1","EN TRAMITE","19-02-2018 23:20 hs."
"LICITACIÓN PÚBLICA","Sin Modalidad","2",2018,"ADQUIRIR MEDICAMENTOS DE ALTO COSTO PARA UN PERIODO DE TRES MESES.",,"PROD.MEDICINALES-PROD.QUIM.-INSUMOS P/ENV.MEDICINALES/PRODUCTOS MEDICINALES PARA USO HUMANO","PESOS",4000000,"HOSPITAL PROVINCIAL DE ROSARIO","HOSPITAL PROVINCIAL DE ROSARIO","21-02-2018 10:00 hs.","OFICINA DE COMPRAS DEL HOSPITAL PROVINCIAL DE ROSARIO","PESOS","$  1.600.- (PESOS MIL SEISCIENTOS)","258/18","https://www.santafe.gov.ar/gestionesdecompras/site/gestion.php?idGestion=120687&contar=1&solodocs=1","CONCLUIDA","21-06-2018 10:41 hs."
"LICITACIÓN PÚBLICA","Sin Modalidad","2",2018,"ADQUISICIÓN DE INSUMOS ODONOLOGICOS","ADQUISICIÓN DE INSUMOS ODONOLOGICOS CON DESTINO A LA COORDINACION DE SERVICIOS ODONTOLOGICOS.","EQUIP.MEDICO P/HOSPITALES Y CENTROS SANITARIOS/EQUIPOS E INSUMOS ODONTOLOGICOS","PESOS",4411815,"MINISTERIO DE SALUD (DIR.GRAL.ADM.)","MINISTERIO DE SALUD - COORDINACIÓN SERVICIOS ODONTOLÓGICOS","28-02-2018 10:00 hs.","MINISTERIO DE SALUD – DPTO DE COMPRAS JUNA DE GARAY 2880 – 3000 STA FE. TEL.: (0342) 4572360/61- – INTERNOS 3121 - 3122 CORREO ELECTRÓNICO: COMPRASALUDSTAFE@SANTAFE.GOV.AR SITIO WEB: WWW.SANTAFE.GOV.AR","PESOS","$  1.770,00","00501-0157712-7","https://www.santafe.gov.ar/gestionesdecompras/site/gestion.php?idGestion=120695&contar=1&solodocs=1","CONCLUIDA","01-08-2018 09:16 hs."
"LICITACIÓN PÚBLICA","Sin Modalidad","2",2018,"CONTRATACIÓN DEL SERVICIO DE VIGILANCIA PARA LA PROTECCIÓN DE INSTALACIONES, BIENES Y PERSONAS EN EL CRSM DR. AGUDO AVILA.-","EN TRAMITE","OTROS SERVICIOS/VIGILANCIA","PESOS",2695000,"CENTRO REGIONAL DE SALUD MENTAL AGUDO AVILA","CENTRO REGIONAL DE SALUD MENTAL AGUDO AVILA","23-02-2018 10:00 hs.","2º OFICINA DE CONTADURIA Y COMPRAS SUIPACHA 667 ROSARIO","PESOS","$     1078,00.-","0037","https://www.santafe.gov.ar/gestionesdecompras/site/gestion.php?idGestion=120702&contar=1&solodocs=1","CONCLUIDA","08-03-2018 11:20 hs."
"LICITACIÓN PÚBLICA","Sin Modalidad","2",2018,"""ADQUISICION DE INSUMOS DESCARTABLES I""","""ADQUISICION DE INSUMOS DESCARTABLES I""","EQUIP.MEDICO P/HOSPITALES Y CENTROS SANITARIOS/MATERIAL DESCARTABLE","PESOS",8800000,"HOSPITAL DE NIÑOS DR. ORLANDO ALASSIA","HOSPITAL DE NIÑOS DR. ORLANDO ALASSIA","05-03-2018 10:00 hs.","OFICINA DE LICITACIONES Y COMPRAS - HOSPITAL DE NIÑOS DR. O. ALASSIA","PESOS","$ 3520,00 (SON PESOS TRES MIL QUINIENTOS VEINTE CON 00/00)",,"https://www.santafe.gov.ar/gestionesdecompras/site/gestion.php?idGestion=120710&contar=1&solodocs=1","CONCLUIDA","16-04-2018 12:52 hs."
"LICITACIÓN PÚBLICA","Sin Modalidad","2",2018,"ADQUISICIÓN DE MEDICAMENTOS","ADQUISICION DE MEDICAMENTOS PARA BENEFICIARIOS DE LOS PROGRAMAS DE DESARROLLO SOCIAL E INCLUIR SALUD PARA EL SERVICIO DE FARMACIA.","PROD.MEDICINALES-PROD.QUIM.-INSUMOS P/ENV.MEDICINALES/PRODUCTOS MEDICINALES PARA USO HUMANO","PESOS",1300000,"HOSPITAL PROVINCIAL DE NIÑOS ZONA NORTE DR. ROBERTO M. CARRA ROSARIO","MINISTERIO DE SALUD (DIR.GRAL.ADM.)","05-03-2018 09:00 hs.","OFICINA DE COMPRAS","PESOS","520",,"https://www.santafe.gov.ar/gestionesdecompras/site/gestion.php?idGestion=120718&contar=1&solodocs=1","CONCLUIDA","06-04-2018 09:01 hs."
"LICITACIÓN PÚBLICA","Sin Modalidad","2",2018,"CONTRATACION DE UN SERVICIO DE VIGILANCIA CON DESTINO A LOS CENTROS DE SALUD DE APS NODO ROSARIO","CONTRATACION DE UN SERVICIO DE VIGILANCIA CON DESTINO A LOS CENTROS DE SALUD DE APS NODO ROSARIO, SEGUN ESPECIFICACIONES ESTABLECIDAS EN LOS ANEXOS ADJUNTOS ","OTROS SERVICIOS/VIGILANCIA","PESOS",6772800,"HOSPITAL PROVINCIAL DE ROSARIO - APS","HOSPITAL PROVINCIAL DE ROSARIO - APS","11-04-2018 10:00 hs.","OFICINA DE COMPRAS Y SUMINISTROS APS ROSARIO - ALEM 1450 - 2000 - ROSARIO - TEL (0341) 4721502","PESOS","2709.12- (PESOS DOS MIL SETECIENTOS 9 CON 12CENTAVOS)","033-2018","https://www.santafe.gov.ar/gestionesdecompras/site/gestion.php?idGestion=120850&contar=1&solodocs=1","EN TRAMITE","11-04-2018 23:20 hs."
"LICITACIÓN PÚBLICA","Sin Modalidad","2",2018,"ADQUISICION DE REACTIVOS LABORATORIO","ADQUISICION REACTIVOS LABORATORIOS","PROD.MEDICINALES-PROD.QUIM.-INSUMOS P/ENV.MEDICINALES/PRODUCTOS QUIMICOS PARA LABORATORIO","PESOS","1294783,43","HOSPITAL CENTRAL RECONQUISTA OLGA STUKY DE RIZZI","HOSPITAL CENTRAL RECONQUISTA OLGA STUKY DE RIZZI","25-04-2018 09:00 hs.","HOSPITAL CENTRAL RECONQUISTA OLGA STUKY DE RIZZI - HIPOLITO YRIGOYEN Nº 1580 - 1º PISO SECTOR COMPRAS","PESOS","$  520.-",,"https://www.santafe.gov.ar/gestionesdecompras/site/gestion.php?idGestion=120898&contar=1&solodocs=1","EN TRAMITE","25-04-2018 23:20 hs."
"LICITACIÓN PÚBLICA","Sin Modalidad","2",2018,"ADQUICISION DE PROVISION POR GAS GLP A GRANEL CON DESTINO A ESTA COLONIA PSIQUATRICA DE OLIVEROS "" DR. A. I. FREYRE""","ADQUISICION DE PROVISION POR GAS GLP A GRANEL (C/ENV INCLUIDO A PRESTAMO) CON DESTINO A LOS LUGARES INSTALADOS DE ESTA COLONIA PSIQ DE OLIVEROS "" DR. A. I. FREYRE""","GASES/GASES","PESOS",1328000,"COLONIA PSIQUIÁTRICA OLIVEROS","COLONIA PSIQUIÁTRICA OLIVEROS","03-05-2018 10:30 hs.","OFICINA DE COMPRAS (EDIFICIO DE ADMINISTRACION) - COLONIA PSIQ DE OLIVEROS ""DR. A. I. FREYRE""","PESOS","$  532,00 (QUINIENTOS TREINTA Y DOS)",,"https://www.santafe.gov.ar/gestionesdecompras/site/gestion.php?idGestion=120907&contar=1&solodocs=1","CONCLUIDA","18-07-2018 11:48 hs."
"LICITACIÓN PÚBLICA","Sin Modalidad","2",2018,"CONTRATACIÓN DE UN SERVICIO DE LIMPIEZA INTEGRAL DE LOS INMUEBLES QUE OCUPA I.A.P.O.S. PARA FUNCIONAMIENTO EN LA CIUDAD DE SANTA FE",,"SERVICIO DE MANTENIMIENTO, REPARACION Y LIMPIEZA/SERVICIO DE MANTENIMIENTO, REPARACION Y LIMPIEZA|  SERVICIO DE MANTENIMIENTO, REPARACION Y LIMPIEZA/SERVICIO DE LIMPIEZA","PESOS",1255800,"INSTITUTO AUTÁRQUICO PROVINCIAL DE OBRA SOCIAL","INSTITUTO AUTÁRQUICO PROVINCIAL DE OBRA SOCIAL","22-05-2018 12:00 hs.","I.A.P.O.S. - COORD. CONTRATACIONES Y SUMINISTROS - SAN MARTÍN 3145 - SANTA FE  - C.P.3000 - SANTA FE","PESOS","SON PESOS: QUINIENTOS DOS CON 32/100.-","15302-0013202-7","https://www.santafe.gov.ar/gestionesdecompras/site/gestion.php?idGestion=120952&contar=1&solodocs=1","EN TRAMITE","22-05-2018 23:20 hs."
"LICITACIÓN PÚBLICA","Sin Modalidad","2",2018,"LOCACIÓN DE UN INMUEBLE  CON DESTINO A OFICINAS  PARA LA CÁMARA DE SENADORES",,"ALQUILERES/ALQUILER DE INMUEBLES","PESOS",735000,"CÁMARA DE SENADORES","CÁMARA DE SENADORES","29-05-2018 10:00 hs.","DIRECCIÓN GENERAL DE ADMINISTRACIÓN DE LA CÁMARA DE SENADORES, SITA EN CALLE GRAL. LÓPEZ 3055 - PISO 1° - DE LA CIUDAD DE SANTA FE","PESOS","$  1.512( PESOS UN MIL QUINIENTOS DOCE CON 00/100 ","37081","https://www.santafe.gov.ar/gestionesdecompras/site/gestion.php?idGestion=121015&contar=1&solodocs=1","EN TRAMITE","29-05-2018 23:20 hs."
"LICITACIÓN PÚBLICA","Sin Modalidad","2",2018,"CONTRATACIÓN DE UN SERVICIO DE VIGILANCIA PARA EL HOSPITAL “JULIO CÉSAR VILLANUEVA” DE SAN CRISTÓBAL",,"OTROS SERVICIOS/VIGILANCIA","PESOS",2001000,"HOSPITAL SAMCO DE SAN CRISTÓBAL","HOSPITAL SAMCO DE SAN CRISTÓBAL","13-08-2018 09:00 hs.",,"PESOS","$ 800,40","00501-0160072-4","https://www.santafe.gov.ar/gestionesdecompras/site/gestion.php?idGestion=121249&contar=1&solodocs=1","EN TRAMITE","13-08-2018 23:20 hs."
"LICITACIÓN PÚBLICA","Sin Modalidad","2",2018,"PROVISIÓN DE RESMAS DE PAPEL CON DESTINO A LA API PARA IMPRESION DE BOLETAS DE IMPUESTOS DE LA PROVINCIA DE SANTA FE","PROVISIÓN DE RESMAS DE PAPEL CON DESTINO A LA API PARA IMPRESION DE BOLETAS DE IMPUESTOS DE LA PROVINCIA DE SANTA FE","PAPELES/PAPELES","PESOS",6098400,"ADMINISTRACIÓN PROVINCIAL DE IMPUESTOS (D.G.A)","ADMINISTRACIÓN PROVINCIAL DE IMPUESTOS (D.G.A)","25-09-2018 12:00 hs.","DEPARTAMENTO DE COMPRAS Y SUMINISTROS, AVENIDA PRESIDENTE ARTURO ILLIA 1151, CENTRO CÍVICO GUBERNAMENTAL, PLANTA BAJA, ALA SUR, OFICINA 04.","PESOS","$  2440","13301-0288717-3","https://www.santafe.gov.ar/gestionesdecompras/site/gestion.php?idGestion=121444&contar=1&solodocs=1","PARA APERTURA","11-09-2018 08:06 hs."
