"Tipo de Gestion","Modalidad","Número","Año","Objeto","Descripción","Rubros|SubRubros","Moneda del pliego","Monto Original","Organismo Licitante","Organismos Comitentes","Fecha y Hora de Apertura","Lugar de Apertura","Moneda del pliego","Valor del Pliego   ","Expedientes","Enlaces Documentacion","Estado de la Gestion","Fecha de Último Estado"
"CONCURSO PÚBLICO","Sin Modalidad","1",2018,"CONTRATACION DE UN SERVICIO DE DISEÑO DE UN PROYECTO EJECUTIVO PARA EL DESARROLLO CONCEPTUAL DEL MUSEO DEL DEPORTE SANTAFESINO, QUE DEBERÁ INCLUIR LA PROVISION, INSTALACION Y PUESTA EN FUNCIONAMIENTO DE EQUIPAMIENTO Y LUMINARIAS, CAPACITACION Y MANTENIMIENTO, CON DESTINO AL MUSEO DEL DEPORTE SANTAFESINO EN LA CIUDAD DE ROSARIO DEPENDIENTE DEL MINISTERIO DE INNOVACIÓN Y CULTURA","CONTRATACION DE SERVICIO DE DISEÑO DE  PROYECTO EJECUTIVO ","PROV. INST. Y PUESTA EN FUNCIONAMIENTO/PROV. INST. Y PUESTA EN FUNCIONAMIENTO","PESOS",129974600,"SUBSECRETARÍA DE CONTRATACIONES Y GESTIÓN DE BIENES","MINISTERIO DE INNOVACIÓN Y CULTURA","13-08-2018 11:00 hs.","SUBSECRETARIA DE CONTRATACIONES Y GESTION DE BIENES, MENDOZA 2905, SANTA FE, SANTA FE","PESOS","$ 52000","01201-0012616-0","https://www.santafe.gov.ar/gestionesdecompras/site/gestion.php?idGestion=121251&contar=1&solodocs=1","EN TRAMITE","13-08-2018 23:20 hs."
"CONCURSO DE PRECIOS","Sin Modalidad","1",2018,"ALQUILER INMUEBLE EN LA CIUDAD DE LAS ROSAS PARA FUNCIONAMIENTO DE LA DELEGACIÓN DEL I.A.P.O.S.",,"EDIFICIOS E INSTALACIONES/EDIFICIOS E INSTALACIONES","PESOS",159125,"INSTITUTO AUTÁRQUICO PROVINCIAL DE OBRA SOCIAL","INSTITUTO AUTÁRQUICO PROVINCIAL DE OBRA SOCIAL","10-04-2018 11:00 hs.","I.A.P.O.S. - DPTO. CONTRATACIONES - SAN MARTÍN 3145 - C.P. 3000 - SANTA FE","PESOS","SON PESOS: SESENTA Y TRES CON 65/100.-","15302-0010397-7","https://www.santafe.gov.ar/gestionesdecompras/site/gestion.php?idGestion=120842&contar=1&solodocs=1","EN TRAMITE","10-04-2018 23:20 hs."
"CONCURSO DE PRECIOS","Sin Modalidad","1",2018,"""CONSTRUCCION DE OFICINA TECNICA PARA EL FUNCIONAMIENTO DEL DEPARTAMENTO DE OBRA PUBLICA - TRIBUNAL DE CUENTAS DE LA PROVINCIA DE SANTA FE - DOCMICILIO SAN JERONIMO 1701","""CONSTRUCCION DE OFICINA TECNICA PARA EL FUNCIONAMIENTO DEL DEPARTAMENTO DE OBRA PUBLICA - TRIBUNAL DE CUENTAS DE LA PROVINCIA DE SANTA FE - DOCMICILIO SAN JERONIMO 1701","CONSTRUCCIONES/OBRAS","PESOS",124800,"TRIBUNAL DE CUENTAS","TRIBUNAL DE CUENTAS","07-05-2018 10:00 hs.","SAN JERÓNIMO 1850 - D.G.A. - COORDINACION GENERAL DE SAERVICIOS CENTRALES Y CONTRACIONES","PESOS","$  150.00","00901-0083422-7","https://www.santafe.gov.ar/gestionesdecompras/site/gestion.php?idGestion=120959&contar=1&solodocs=1","EN TRAMITE","07-05-2018 23:20 hs."
"LICITACIÓN PÚBLICA","Sin Modalidad","1",2018,"CTRO DE PEDIDO: FARMACIA- NUTRICIONES PARENTERALES","NUTRICIONES PARENTERALES PARA EL SERVICIO DE NEONATOLOGÍA CON BOMBAS DE INFUSIÓN EN COMODATO","PROD.MEDICINALES-PROD.QUIM.-INSUMOS P/ENV.MEDICINALES/PRODUCTOS MEDICINALES PARA USO HUMANO","PESOS",1300000,"HOSPITAL CENTENARIO ROSARIO","HOSPITAL CENTENARIO ROSARIO","05-01-2018 10:00 hs.","OFICINA DE COMPRAS","PESOS","SON PESOS QUINIENTOS VEINTE CON 00/100 ($ 520.-)","3966/2017","https://www.santafe.gov.ar/gestionesdecompras/site/gestion.php?idGestion=120562&contar=1&solodocs=1","CONCLUIDA","02-02-2018 18:21 hs."
"LICITACIÓN PÚBLICA","Sin Modalidad","1",2018,"OBRA: RECONSTRUCCION CUBIERTA EN PABELLON Nº 2 DE ESTA COLONIA PSIQUIATRICA DE OLIVEROS ""DR. A. I. FREYRE""","CONTRATACION PARA LA PROVISION DE OBRA POR LA RECONSTRUCCION DE CUBIERTA EN PABELLON Nº 2 DE ESTA COLONIA PSIQUIATRICA DE OLIVEROS "" DR. A. I. FREYRE"" (SEGUN MEMORIA DESCRIPTIVA EN PBYC)","CONSTRUCCIONES/OBRAS","PESOS","1399111,45","COLONIA PSIQUIÁTRICA OLIVEROS","COLONIA PSIQUIÁTRICA OLIVEROS","10-01-2018 10:00 hs.","COLONIA PSIQUIATRICA DE OLIVEROS "" DR. A. I. FREYRE"" - OFICINA DE COMPRAS, PATRIMONIO Y SUMINISTROS","PESOS","$  559,64 (PESOS QUINIENTOS CINCUENTA Y NUEVE C/64/00)","00501-0156601-7","https://www.santafe.gov.ar/gestionesdecompras/site/gestion.php?idGestion=120563&contar=1&solodocs=1","CONCLUIDA","31-01-2018 13:04 hs."
"LICITACIÓN PÚBLICA","Sin Modalidad","1",2018,"CONTRATACIÓN DEL SERVICIO DE VIGILANCIA PARA LA PROTECCIÓN DE INSTALACIONES, BIENES Y PERSONAS EN EL CENTRO REGIONAL DE SALUD MENTAL ""DR AGUDO AVILA""",,"OTROS SERVICIOS/VIGILANCIA","PESOS",2695000,"CENTRO REGIONAL DE SALUD MENTAL AGUDO AVILA","CENTRO REGIONAL DE SALUD MENTAL AGUDO AVILA","22-01-2018 10:00 hs.","2º PISO OFICINA DE CONTADURÍA Y COMPRAS. SUIPACHA 667. ROSARIO.","PESOS","$  1078","0554 - D","https://www.santafe.gov.ar/gestionesdecompras/site/gestion.php?idGestion=120589&contar=1&solodocs=1","CONCLUIDA","07-03-2018 12:11 hs."
"LICITACIÓN PÚBLICA","Sin Modalidad","1",2018,"ADQUISICIÓN DE MATERIAL DESCARTABLE PARA EL SERVICIO DE ESTERILIZACIÓN ","ADQUISICIÓN DE MATERIAL DESCARTABLE PARA EL SERVICIO DE ESTERILIZACIÓN ","EQUIP.MEDICO P/HOSPITALES Y CENTROS SANITARIOS/EQUIPOS, INSTRUMENTAL E INSUMOS MEDICOS|  EQUIP.MEDICO P/HOSPITALES Y CENTROS SANITARIOS/MATERIAL DESCARTABLE","PESOS","5987297,14","HOSPITAL DR. JOSE MARÍA CULLEN","HOSPITAL DR. JOSE MARÍA CULLEN","15-01-2018 10:00 hs.","DIVISIÓN COMPRAS HOSPITAL DR. JOSÉ MARÍA CULLEN, AV. FREYRE Nº 2150, 1º PISO . SANTA FE - CP. 3000","PESOS","$  2.395,00.-","3934/2017","https://www.santafe.gov.ar/gestionesdecompras/site/gestion.php?idGestion=120595&contar=1&solodocs=1","EN TRAMITE","15-01-2018 23:20 hs."
"LICITACIÓN PÚBLICA","Sin Modalidad","1",2018,"LOCACION DE UN INMUEBLE EN LA CIUDAD DE VERA CON DESTINO A LA SECRETARIA DE TECNOLOGIAS PARA LA GESTION DEPENDIENTE DEL MINISTERIO DE GOBIERNO Y REFORMA DEL ESTADO","LOCACION DE UN INMUEBLE ","ALQUILERES/ALQUILER DE INMUEBLES","PESOS",538200,"SUBSECRETARÍA DE CONTRATACIONES Y GESTIÓN DE BIENES","SUBSECRETARÍA DE CONTRATACIONES Y GESTIÓN DE BIENES|  MINISTERIO DE GOBIERNO Y REFORMA DEL ESTADO (DIR. ADM.)","22-01-2018 11:00 hs.","SUBSECRETARIA DE CONTRATACIONES Y GESTION DE BIENES, MENDOZA 2905, SANTA FE, SANTA FE","PESOS","$ 220","00108-0008546-8","https://www.santafe.gov.ar/gestionesdecompras/site/gestion.php?idGestion=120605&contar=1&solodocs=1","CONCLUIDA","23-01-2018 00:00 hs."
"LICITACIÓN PÚBLICA","Sin Modalidad","1",2018,"ADQUISICIÓN MEDICAMENTOS, SUEROS ,SOLUCIONES, LECHES MATERNIZADAS, ALIMENTACIÓN ENTERAL Y PARENTERAL EN DOS ENTREGAS DE 0 Y 30 DÍAS",,"PROD.MEDICINALES-PROD.QUIM.-INSUMOS P/ENV.MEDICINALES/PRODUCTOS MEDICINALES PARA USO HUMANO","PESOS",1300000,"HOSPITAL SAMCO DR. JAIME FERRÉ","HOSPITAL SAMCO DR. JAIME FERRÉ","23-01-2018 08:30 hs.","SECCION COMPRAS Y SUMINISTROS ","PESOS","$  520.-",,"https://www.santafe.gov.ar/gestionesdecompras/site/gestion.php?idGestion=120607&contar=1&solodocs=1","EN TRAMITE","23-01-2018 23:20 hs."
"LICITACIÓN PÚBLICA","Sin Modalidad","1",2018,"ADQUISICION DE MATERIALES DECARTABLES PARA UN PERIODO DE TRES (3) MESES CON DESTINO A LOS CENTROS DE SALUD DEPENDIENTES DEL NODO ROSARIO (APS ROSARIO)","ADQUISICION DE MATERIALES DECARTABLES PARA UN PERIODO DE TRES (3) MESES CON DESTINO A LOS CENTROS DE SALUD DEPENDIENTES DEL NODO ROSARIO (APS ROSARIO)","EQUIP.MEDICO P/HOSPITALES Y CENTROS SANITARIOS/MATERIAL DESCARTABLE","PESOS",2105350,"HOSPITAL PROVINCIAL DE ROSARIO - APS","HOSPITAL PROVINCIAL DE ROSARIO - APS","18-01-2018 10:00 hs.","OFICINA DE COMPRAS  Y SUMINISTROS APS ROSARIO - HOPSITAL PROVINCIAL DE ROSARIO - ALEM 1450 - TEL/FAX (0341) 4721502","PESOS","$ 842 (PESOS OCHOCIENTOS CUARENTA Y DOS)",,"https://www.santafe.gov.ar/gestionesdecompras/site/gestion.php?idGestion=120614&contar=1&solodocs=1","EN TRAMITE","18-01-2018 23:20 hs."
"LICITACIÓN PÚBLICA","Sin Modalidad","1",2018,"ADQUISICION DE MATERIAL DESCARTABLE PARA 3 MESES Y CON 3 ENTREGAS","LICITACION PUBLICA Nº 01/18","EQUIP.MEDICO P/HOSPITALES Y CENTROS SANITARIOS/MATERIAL DESCARTABLE","PESOS",15400000,"HOSPITAL J.B. ITURRASPE","HOSPITAL J.B. ITURRASPE","26-01-2018 10:00 hs.","HOSPITAL J.B. ITURRASPE - BV. PELLEGRINI 3551 1º PISO - OFICINA DE COMPRAS - SANTA FE - 3000","PESOS","$   6.160","000016/18","https://www.santafe.gov.ar/gestionesdecompras/site/gestion.php?idGestion=120634&contar=1&solodocs=1","CONCLUIDA","20-03-2018 11:35 hs."
"LICITACIÓN PÚBLICA","Sin Modalidad","1",2018,"""ADQUISICIÓN DE MEDICAMENTOS VARIOS I""","""ADQUISICIÓN DE MEDICAMENTOS VARIOS I""","PROD.MEDICINALES-PROD.QUIM.-INSUMOS P/ENV.MEDICINALES/PRODUCTOS MEDICINALES PARA USO HUMANO","PESOS",4600000,"HOSPITAL DE NIÑOS DR. ORLANDO ALASSIA","HOSPITAL DE NIÑOS DR. ORLANDO ALASSIA","22-02-2018 10:00 hs.","OFICINA DE LICITACIONES - HOSPITAL DE NIÑOS DR. O. ALASSIA","PESOS","$  1.850,00 (SON PESOS UN MIL OCHOCIENTOS CINCUENTA CON 00/00)",,"https://www.santafe.gov.ar/gestionesdecompras/site/gestion.php?idGestion=120661&contar=1&solodocs=1","CONCLUIDA","16-04-2018 10:28 hs."
"LICITACIÓN PÚBLICA","Sin Modalidad","1",2018,"ADQUISICIÓN DE MEDICAMENTOS","MEDICAMENTOS VARIOS","PROD.MEDICINALES-PROD.QUIM.-INSUMOS P/ENV.MEDICINALES/PRODUCTOS MEDICINALES PARA USO HUMANO","PESOS",1200000,"HOSPITAL PROVINCIAL DE NIÑOS ZONA NORTE DR. ROBERTO M. CARRA ROSARIO","MINISTERIO DE SALUD (DIR.GRAL.ADM.)","07-02-2018 10:00 hs.","OF. DE COMPRAS","PESOS","480",,"https://www.santafe.gov.ar/gestionesdecompras/site/gestion.php?idGestion=120663&contar=1&solodocs=1","CONCLUIDA","26-06-2018 08:17 hs."
"LICITACIÓN PÚBLICA","Sin Modalidad","1",2018,"ADQUIRIR MATERIALES DESCARTABLES PARA UN PERIODO DE TRES (3) MESES.",,"EQUIP.MEDICO P/HOSPITALES Y CENTROS SANITARIOS/MATERIAL DESCARTABLE","PESOS",6500000,"HOSPITAL PROVINCIAL DE ROSARIO","HOSPITAL PROVINCIAL DE ROSARIO","15-02-2018 10:00 hs.","OFICINA DE COMPRAS DEL HOSPITAL PROVINCIAL DE ROSARIO","PESOS","$  2.600.- (PESOS DOS MIL SEISCIENTOS)","228/18","https://www.santafe.gov.ar/gestionesdecompras/site/gestion.php?idGestion=120682&contar=1&solodocs=1","CONCLUIDA","16-07-2018 11:04 hs."
"LICITACIÓN PÚBLICA","Sin Modalidad","1",2018," SOLICITUD DE MATERIAL DE OSTEOSINTESIS Y ORTOPEDIA Y TRAUMATOLOGIA","LICITACION PUBLICA PARA LA  SOLICITUD DE MATERIAL DE OSTEOSINTESIS Y ORTOPEDIA Y TRAUMATOLOGIA","PROD.MEDICINALES-PROD.QUIM.-INSUMOS P/ENV.MEDICINALES/PRODUCTOS MEDICINALES PARA USO HUMANO","PESOS","11175771,6","HOSPITAL ESCUELA EVA PERÓN","HOSPITAL ESCUELA EVA PERÓN","20-02-2018 10:00 hs.","HOSPITAL ESCUELA EVA PERON - AV, SAN MARTIN 1645 -2152 GRANADERO BAIGORRIA -  OFICINA DE COMPRAS","PESOS","$  4470,31 - PESOS: CUATRO MIL CUATROCIENTOS SETENTA C/31/00","24510","https://www.santafe.gov.ar/gestionesdecompras/site/gestion.php?idGestion=120683&contar=1&solodocs=1","CONCLUIDA","10-05-2018 09:57 hs."
"LICITACIÓN PÚBLICA","Sin Modalidad","1",2018,"ADQUISICIÓN DE MEDICAMENTOS ONCOLOGICOS","ADQUISICIÓN DE MEDICAMENTOS ONCOLOGICOS CON DESTINO AL BANCO DE DROGAS ONCOLOGICAS.","PROD.MEDICINALES-PROD.QUIM.-INSUMOS P/ENV.MEDICINALES/PROD.MEDICINALES-PROD.QUIM.-INSUMOS P/ENV.MEDICINALES","PESOS","12468014,2","MINISTERIO DE SALUD (DIR.GRAL.ADM.)","MINISTERIO DE SALUD - D.P. RED DE MEDICAMENTOS Y TECN. FARMACÉUTICA","21-02-2018 10:00 hs.","MINISTERIO DE SALUD – DPTO DE COMPRAS JUNA DE GARAY 2880 – 3000 STA FE. TEL.: (0342) 4572360/61- – INTERNOS 3121 - 3122 CORREO ELECTRÓNICO: COMPRASALUDSTAFE@SANTAFE.GOV.AR SITIO WEB: WWW.SANTAFE.GOV.AR","PESOS","$   5.000,00","00501-0159292-0","https://www.santafe.gov.ar/gestionesdecompras/site/gestion.php?idGestion=120694&contar=1&solodocs=1","CONCLUIDA","18-06-2018 09:55 hs."
"LICITACIÓN PÚBLICA","Sin Modalidad","1",2018,"CONTRATACION DE UN SERVICIO DE AMPLIACION Y REACONDICIONAMIENTO EDILICIO DEL SAMCO DE COLONIA MASCIAS."," AMPLIACION Y REACONDICIONAMIENTO EDILICIO DEL SAMCO DE COLONIA MASCIAS","CONSTRUCCIONES/OBRAS","PESOS","3081693,1","HOSPITAL HELVECIA","HOSPITAL HELVECIA","26-02-2018 10:30 hs.","HOSPITAL HELVECIA, VELEZ SARFIELD 830, HELVECIA, CP:3003","PESOS","$    1237,70 DEBERA HACERSE EFECTIVO MEDIANTE DEPOSITO EN CTA. CTE. NRO 522-766/10 (CBU 3300522315220000766108) DEL NVO BCO DE SANTA FE S.A.","00501-0157263-8","https://www.santafe.gov.ar/gestionesdecompras/site/gestion.php?idGestion=120700&contar=1&solodocs=1","EN TRAMITE","26-02-2018 23:20 hs."
"LICITACIÓN PÚBLICA","Sin Modalidad","1",2018,"CONTRATACIÓN DE UN SERVICIO DE VIGILANCIA PARA LAS DEPENDENCIAS DE LA REGIONAL ROSARIO DE A.P.I. SITAS EN TUCUMÁN 1853 DE DICHA CIUDAD.","CONTRATACIÓN POR 12 (DOCE) MESES DE UN SERVICIO DE VIGILANCIA EN DEPENDENCIAS DE LA REGIONAL ROSARIO A.P.I., CON VIGILANCIA PERSONAL Y MEDIANTE EQUIPOS DE VIDEOCÁMARAS DE PROPIEDAD DEL OFERENTE.","OTROS SERVICIOS/VIGILANCIA","PESOS",1002000,"ADMINISTRACIÓN PROVINCIAL DE IMPUESTOS (D.G.A)","ADMINISTRACIÓN PROVINCIAL DE IMPUESTOS (D.G.A)","22-02-2018 12:00 hs.","DEPARTAMENTO DE COMPRAS Y SUMINISTROS DE A.P.I., SITO EN AV. PTE. ARTURO ILLIA 1151, PLANTA BAJA, ALA SUR, OFICINA 04, CENTRO CÍVICO GUBERNAMENTAL - SANTA FE","PESOS","$    400,80 (PESOS CUATROSCIENTOS CON OCHENTA CENTAVOS)","13301-0281318-9","https://www.santafe.gov.ar/gestionesdecompras/site/gestion.php?idGestion=120717&contar=1&solodocs=1","CONCLUIDA","11-09-2018 07:51 hs."
"LICITACIÓN PÚBLICA","Sin Modalidad","1",2018,"“CONSTRUCCIÓN AULAS EN ESCUELAS – 3RA ETAPA”","EL TRABAJO CONSISTE EN LA EJECUCIÓN DE UNA O DOS AULAS SEGÚN SE INDIQUE EN PLANOS ANEXAS AL EDIFICIO EXISTENTE QUE MANTENGA Y RESPETE SUS CARACTERÍSTICAS COMPONIÉNDOSE COMO UNA EXTENSIÓN DEL MISMO, DEBIENDO SUMAR A SU CONSTRUCCIÓN LAS CONDICIONES DE MEJORAS IMPUESTAS POR PROYECTO. NO DEBERÁ INTERRUMPIR LA VISIÓN TOTAL DE LA ESCUELA COMO UN CONJUNTO Y ACONDICIONARÁ LAS SOLUCIONES A LOS DISTINTOS PROBLEMAS QUE SURGIERAN DE ACUERDO A ESTE CRITERIO.   DE RESOLUCIÓN TÉCNICA SENCILLA, LA NUEVA CONSTRUCCIÓN DEBERÁ REDUCIR SU IMPACTO EN EL FUNCIONAMIENTO DEL EDIFICIO DURANTE SU EJECUCIÓN EN EL MENOR GRADO POSIBLE. LA LIMPIEZA Y EL ORDEN DE LA OBRA SON CONDICIONES ESTRICTAMENTE NECESARIAS.   LOS CAMBIOS DE RESOLUCIÓN TECNOLÓGICA QUE EL AULA NUEVA INCORPORA RESPECTO AL EDIFICIO EXISTENTE RESPONDEN A MEJORAS CONSTRUCTIVAS Y DE MANTENIMIENTO SENSIBLES. LOS CAMBIOS TECNOLÓGICOS EN FUNDACIONES, CERRAMIENTOS LATERALES O CUBIERTAS ESTÁN CONSIDERADOS PARA ALTERAR LO MENOS POSIBLE LA PREEXISTENCIA Y COMPORTARSE DE MANERA INDEPENDIENTE. PARA CADA INTERVENCIÓN QUE COMPROMETA ESTRUCTURA EXISTENTE NO DEBE COMPROMETER LA CAPACIDAD PORTANTE PREVIÉNDOSE LA EXIGENCIA DE LA VERIFICACIÓN ESTRUCTURAL Y EVENTUAL CONSTRUCCIÓN DE LOS REFUERZOS NECESARIOS.    PARA LAS INSTALACIONES SANITARIAS, EL PROYECTO PREVEE LA EVENTUAL INCORPORACIÓN A SISTEMAS EXISTENTES, DE TAL MANERA DEBERÁ RELEVARSE SU CORRECTO FUNCIONAMIENTO. DE EXISTIR INCONVENIENTES SE PROYECTARÁ Y EJECUTARÁ DE FORMA INDEPENDIENTE CONFORME APROBACIÓN DE LA INSPECCIÓN. EN EL CASO DEL GAS, SE PREVEEN CONDICIONES PREEXISTENTES NECESARIAS Y QUEDARÁ A CRITERIO DE LA INSPECCIÓN Y DE LOS RESPONSABLES DEL INMUEBLE LOS CRITERIOS DE POSIBLE EXTENSIÓN. SU REEMPLAZO O ACONDICIONAMIENTO DEBERÁ CONSTATARSE EN OBRA Y CON EL ENTE REGULADOR PERTINENTE. ","CONSTRUCCIONES/CONSTRUCCIONES CIVILES|  CONSTRUCCIONES/OBRAS","PESOS",1,"MINISTERIO DE ECONOMÍA - PROGRAMA MUNICIPAL DE INVERSIONES - PROMUDI","MINISTERIO DE ECONOMÍA - PROGRAMA MUNICIPAL DE INVERSIONES - PROMUDI","20-03-2018 11:00 hs.","MINISTERIO DE EDUCACIÓN - AV. PRES. ILLIA Nº1101, SANTA FE - 5TO PISO - SALA BELGRANO","PESOS","EN VIRTUD DE LOS ALCANCES DEL ARTICULO 4° DEL DECRETO 2260/16, LOS PLIEGOS SON GRATUITOS Y SE PUBLICARÁN EN EL SITIO WEB OFICIAL DE LA PROVINCIA DE SANTA FE, SUBPORTAL “COMPRAS”",,"https://www.santafe.gov.ar/gestionesdecompras/site/gestion.php?idGestion=120740&contar=1&solodocs=1","CONCLUIDA","10-05-2018 11:36 hs."
"LICITACIÓN PÚBLICA","Sin Modalidad","1",2018,"EJECUCION DE OBRA REACONDICIONAMIENTO EDILICIO","VISITA DE OBRA OBLIGATORIA:23/03/18   10HS","EDIFICIOS E INSTALACIONES/EDIFICIOS E INSTALACIONES","PESOS","2255295,8","HOSPITAL SAMCO DE VILLA ANA","HOSPITAL SAMCO DE VILLA ANA","03-04-2018 10:00 hs.","COMUNA DE VILLA ANA","PESOS","902.11","00501-0158238-1","https://www.santafe.gov.ar/gestionesdecompras/site/gestion.php?idGestion=120803&contar=1&solodocs=1","EN TRAMITE","03-04-2018 23:20 hs."
"LICITACIÓN PÚBLICA","Sin Modalidad","1",2018,"ADQUISICIÓN DE MEDICAMENTOS","ADQUISICIÓN DE MEDICAMENTOS- POR EL PERIODO DE 3 (TRES) MESES","PROD.MEDICINALES-PROD.QUIM.-INSUMOS P/ENV.MEDICINALES/PROD.MEDICINALES-PROD.QUIM.-INSUMOS P/ENV.MEDICINALES","PESOS","2173316,9","HOSPITAL CENTRAL RECONQUISTA OLGA STUKY DE RIZZI","HOSPITAL CENTRAL RECONQUISTA OLGA STUKY DE RIZZI","05-04-2018 09:00 hs.","OFICINA DE COMPRAS - HOSPITAL CENTRAL RECONQUISTA- HIPÓLITO YRIGOYEN Nº 1580- RECONQUISTA 3560","PESOS","870,00","Co 132/18","https://www.santafe.gov.ar/gestionesdecompras/site/gestion.php?idGestion=120834&contar=1&solodocs=1","EN TRAMITE","05-04-2018 23:20 hs."
"LICITACIÓN PÚBLICA","Sin Modalidad","1",2018," ADQUISICIÓN DE 2000 RESMAS DE PAPEL CON DESTINO A LA CÁMARA DE SENADORES",,"LIBRERIA/ARTICULOS DE LIBRERIA","PESOS",250000,"CÁMARA DE SENADORES","CÁMARA DE SENADORES","08-05-2018 10:00 hs.","DIRECCIÓN GENERAL DE ADMINISTRACIÓN DE LA CÁMARA DE SENADORES: GRAL. LÓPEZ 3055- PRIMER PISO DE LA CIUDAD DE SANTA FE","PESOS","$  100.-","37080","https://www.santafe.gov.ar/gestionesdecompras/site/gestion.php?idGestion=120930&contar=1&solodocs=1","CONCLUIDA","12-06-2018 12:43 hs."
"LICITACIÓN PÚBLICA","Sin Modalidad","1",2018,"“ACUEDUCTO GRAN ROSARIO - ETAPA II” - PROVINCIA DE SANTA FE.","EN EL MARCO DEL SISTEMA PROVINCIAL DE ACUEDUCTOS DISEÑADO POR EL GOBIERNO DE LA PROVINCIA DE SANTA FE, SE HA DECIDIDO CONTINUAR CON LA EJECUCIÓN DE LA SEGUNDA ETAPA DEL ACUEDUCTO GRAN ROSARIO, OBRA QUE PERMITIRÁ REALIZAR UN MEJORAMIENTO INTEGRAL DEL ABASTECIMIENTO DE AGUA POTABLE A LA CIUDAD DE ROSARIO LLEGANDO A SUS BARRIOS PERIFÉRICOS Y ADEMÁS, REFORZAR EL ABASTECIMIENTO DE TODO EL GRAN ROSARIO, ES DECIR A LAS POBLACIONES DE RICARDONE, TIMBÚES, PUERTO GENERAL SAN MARTÍN, SAN LORENZO, FRAY LUIS BELTRÁN, CAPITÁN BERMÚDEZ, GRANADERO BAIGORRIA, IBARLUCEA, FUNES, VILLA GOBERNADOR GÁLVEZ, ROLDÁN Y PÉREZ. LA OBRA LICITADA INCLUYE: SECCIÓN 1.- AMPLIACIÓN DE UN MÓDULO COMPLETO DE TRATAMIENTO DE LA PLANTA POTABILIZADORA BAIGORRIA;  SECCIÓN 2.- CONTINUACIÓN DEL ACUEDUCTO GRAN ROSARIO A LO LARGO DE LA AV. DE CIRCUNVALACIÓN HASTA LA AV. PROVINCIAS UNIDAS Y;  SECCIÓN 3.- CONSTRUCCIÓN DE UNA CISTERNA CON SISTEMA DE BOMBEO E IMPULSIÓN EN EL PREDIO UBICADO EN AV. PROVINCIAS UNIDAS AL 3900; LA LICITACIÓN SE EFECTUARÁ CONFORME A LOS PROCEDIMIENTOS ESTABLECIDOS EN LA LEY DE OBRAS PÚBLICAS DE LA PROVINCIA DE SANTA FE Y ESTÁ ABIERTA A LICITANTES DE TODOS LOS PAÍSES, SEGÚN SE DEFINEN EN LOS DOCUMENTOS DE LICITACIÓN. EN PARTICULAR CADA OFERENTE DEBERÁ INCLUIR NECESARIAMENTE COMO PARTE DE SU OFERTA EL FINANCIAMIENTO TOTAL O PARCIAL DE LA OBRA LICITADA, QUE NO PODRÁ SER INFERIOR AL 70% DEL MONTO COTIZADO, SIENDO EL PLAZO DE AMORTIZACIÓN MÍNIMO DE 7 AÑOS, CONSTITUYENDO LA OFERTA ECONÓMICA Y LA PROPUESTA DE FINANCIAMIENTO, UNA PROPUESTA ÚNICA E INESCINDIBLE. LA UNIDAD DE GESTIÓN (UG) CREADA POR DECRETO Nº 1366/15 DEPENDIENTE DE LOS MINISTERIOS DE INFRAESTRUCTURA Y TRANSPORTE Y DE ECONOMÍA, INVITA A LOS LICITANTES A PRESENTAR OFERTAS SELLADAS PARA LA REALIZACIÓN DE LA OBRA “ACUEDUCTO GRAN ROSARIO – ETAPA II” - PROVINCIA DE SANTA FE, QUE SERÁ CONTRATADA BAJO EL SISTEMA DE UNIDAD DE MEDIDA Y PRECIO UNITARIO CON REDETERMINACIÓN DE PRECIOS.","CONSTRUCCIONES/CONSTRUCCIONES CIVILES","PESOS","1143188853,18","MINISTERIO DE ECONOMÍA - UNIDAD EJECUTORA PROVINCIAL - UEP","MINISTERIO DE ECONOMÍA - UNIDAD EJECUTORA PROVINCIAL - UEP","25-09-2018 10:00 hs.","SALÓN BLANCO DE LA CASA DE GOBIERNO, CALLE 3 DE FEBRERO Nº 2649, CIUDAD DE SANTA FE - PROVINCIA DE SANTA FE- REPÚBLICA ARGENTINA.","PESOS","EL DOCUMENTO DE LICITACIÓN SE ENCUENTRA DISPONIBLE HASTA LA FECHA LÍMITE DE PRESENTACIÓN DE LAS PROPUESTAS, POR LO CUAL LOS LICITANTES INTERESADOS PODRÁN DISPONER SIN CARGO DE UN JUEGO COMPLETO DEL MISMO, EN MEDIO MAGNÉTICO, EN LAS OFICINAS DE LA UNIDAD DE GESTIÓN (UG), SITA EN CALLE AV. ARTURO ILLIA Nº 1151, 8VO.PISO, EDIFICIO GUBERNAMENTAL, DE LA CIUDAD DE SANTA FE (C.P. 3000), TELÉFONOS: 00 54 342  4506863/5 Y/O EN EL PORTAL WEB OFICIAL DE LA PROVINCIA DE SANTA FE. SE PODRÁ SOLICITAR INFORMACIÓN ADICIONAL EN LA UNIDAD DE GESTIÓN (UG) Y/O EN LA PÁGINA WEB DE LA PROVINCIA: WWW.SANTAFE.GOV.AR Y ADEMÁS SE PODRÁN CONSULTAR LOS DOCUMENTOS DE LICITACIÓN DE 8:00 A 13:00 HS. EN LA MESA DE ENTRADAS DE LA UEP, AV. PTE. ARTURO ILLIA Nº 1151, 8VO. PISO - (C.P. 3000) SANTA FE, TEL/FAX: 00 54 342  4506863/5 - EMAIL: UEPSANTAFE@SANTAFE.GOV.AR.","00301-0069332-3","https://www.santafe.gov.ar/gestionesdecompras/site/gestion.php?idGestion=121093&contar=1&solodocs=1","PARA APERTURA","07-06-2018 11:35 hs."
"LICITACIÓN PÚBLICA","Sin Modalidad","1",2018,"PROVISION DE MATERIALES Y MANO DE OBRA NECESARIOS PARA LA EJECUCION DE LA SALA DE TOMAGRAFIA Y LOCALES ANEXOS DEL HOSPITAL SAMCO TOSTADO DR. ALFREDO ROSETANI.","ESTE PROYECTO CORRESPONDE A LA DIRECCIÓN GENERAL DE RECURSOS FÍSICOS Y CONSTRUCCIONES HOSPITALARIAS DEPENDIENTE DE LA DIRECCIÓN PROVINCIAL DE ARQUITECTURA E INGENIERÍA EN SALUD DEL MINISTERIO DE SALUD DE LA PROVINCIA DE SANTA FE,   SEGÚN ESPECIFICACIONES ESTABLECIDAS EN LOS ANEXOS ADJUNTOS.-  EL CONCEPTO DE LOS TRABAJOS ES DE OBRA TERMINADA, LISTA PARA USAR. EL SISTEMA DE CONTRATACIÓN ES PRECIO GLOBAL, AJUSTE ALZADO, SEGÚN LO DISPUESTO EN LA LEY PROVINCIAL Nº 12.046 Y SUS DECRETOS REGLAMENTARIOS NROS. 3.599/02 Y 3.873/02.- LAS OBRAS A COTIZAR COMPRENDEN LA CONSTRUCCIÓN DE LA TOTALIDAD DE LAS OBRAS DE ARQUITECTURA Y DE LAS INSTALACIONES Y ESTRUCTURAS QUE LE SON PROPIAS, A FIN DE MATERIALIZAR EL OBJETO DE ESTE LLAMADO LICITATORIO, CON SUJECIÓN A LA DOCUMENTACIÓN ELABORADA POR LA DIRECCIÓN PROVINCIAL DE ARQUITECTURA E INGENIERÍA EN SALUD. ELEMENTOS QUE CONSTITUYEN EL PROYECTO: LAS OBRAS SE EJECUTARÁN DE ACUERDO A LAS CARACTERÍSTICAS ARQUITECTÓNICAS Y CONSTRUCTIVAS QUE SE DETALLAN EN LOS PLANOS Y ESPECIFICACIONES TÉCNICAS QUE INTEGRAN LA PRESENTE.   VISITA DE OBRA OBLIGATORIA: VIERNES 22 DE JUNIO DE 2018 - 10:00HS. ","CONSTRUCCIONES/OBRAS","PESOS","4085955,35","HOSPITAL SAMCO DE TOSTADO","HOSPITAL SAMCO DE TOSTADO","10-07-2018 09:00 hs.","OFINA DE COMPRAS HOSPITAL SAMCO TOSTADO DR. ALFREDO ROSETANI. DIRECCION VUELTA DE OBLIGADO Y RUTA 2.","PESOS","1.634,38",,"https://www.santafe.gov.ar/gestionesdecompras/site/gestion.php?idGestion=121126&contar=1&solodocs=1","EN TRAMITE","10-07-2018 23:20 hs."
"LICITACIÓN PÚBLICA","Sin Modalidad","1",2018,"ADQUISICIÓN DE DOS (2) EQUIPOS DE LABORATORIO CON DESTINO A LA AGENCIA SANTAFESINA DE SEGURIDAD ALIMENTARIA",,"EQUIP.MEDICO P/HOSPITALES Y CENTROS SANITARIOS/EQUIPOS-UTILES-INSUMOS PARA LABORATORIO","PESOS",5328000,"AGENCIA SANTAFESINA DE SEGURIDAD ALIMENTARIA","AGENCIA SANTAFESINA DE SEGURIDAD ALIMENTARIA","25-07-2018 10:00 hs.","AGENCIA SANTAFESINA DE SEGURIDAD ALIMENTARIA - FRANCIA 2690 - CIUDAD DE SANTA FE","PESOS","$  550","15601-0002930-1","https://www.santafe.gov.ar/gestionesdecompras/site/gestion.php?idGestion=121181&contar=1&solodocs=1","EN TRAMITE","25-07-2018 23:20 hs."
"LICITACIÓN PÚBLICA","Sin Modalidad","1",2018,"COBERTURA DE SEGURO PARA VEHICULOS OFIOCIALES DE PROPIEDAD DEL TRIBUNAL DE CUENTAS DE LA PROVINCIA DE SANTA FE","COBERTURA DE SEGURO PARA VEHICULOS OFIOCIALES DE PROPIEDAD DEL TRIBUNAL DE CUENTAS DE LA PROVINCIA DE SANTA FE","OTROS SERVICIOS/SERVICIOS VARIOS","PESOS",1321375,"TRIBUNAL DE CUENTAS","TRIBUNAL DE CUENTAS","27-07-2018 09:00 hs.","SAN JERÓNIMO 1850 - D.G.A. - COORDINACIÓN GENERAL DE SERVICIOS CENTRALES Y  CONTRATACIÓN","PESOS","$  47.76","00901-0083822-3","https://www.santafe.gov.ar/gestionesdecompras/site/gestion.php?idGestion=121189&contar=1&solodocs=1","EN TRAMITE","27-07-2018 23:20 hs."
"LICITACIÓN PÚBLICA","Sin Modalidad","1",2018,"CONTRATACIÓN DE UN SERVICIO DE LIMPIEZA PARA EL HOSPITAL “JULIO CÉSAR VILLANUEVA” DE SAN CRISTÓBAL",,"SERVICIO DE MANTENIMIENTO, REPARACION Y LIMPIEZA/SERVICIO DE LIMPIEZA","PESOS",2358144,"HOSPITAL SAMCO DE SAN CRISTÓBAL","HOSPITAL SAMCO DE SAN CRISTÓBAL","09-08-2018 09:00 hs.","OFICINA DE REUNIONES DEL S.A.M.CO. SAN CRISTÓBAL","PESOS","$  943,26","00501-0161327-8","https://www.santafe.gov.ar/gestionesdecompras/site/gestion.php?idGestion=121233&contar=1&solodocs=1","EN TRAMITE","09-08-2018 23:20 hs."
"LICITACIÓN PÚBLICA","Sin Modalidad","1",2018,"CONTRATAR EL SERVICIO DE LIMPIEZA CON DESTINO A LA CAMARA DE DIPUTADOS Y OTROS ANEXOS DEPENDIENTES DE LA MISMA.",,"SERVICIO DE MANTENIMIENTO, REPARACION Y LIMPIEZA/SERVICIO DE LIMPIEZA","PESOS",1200000,"CÁMARA DE DIPUTADOS","CÁMARA DE DIPUTADOS","13-08-2018 11:00 hs.","SECRETARIA ADMINISTRATIVA - CAMARA DE DIPUTADOS","PESOS","$  360.- (PESOS TRESCIENTOS SESENTA).",,"https://www.santafe.gov.ar/gestionesdecompras/site/gestion.php?idGestion=121257&contar=1&solodocs=1","EN TRAMITE","13-08-2018 23:20 hs."
"LICITACIÓN PÚBLICA","Sin Modalidad","1",2018,"ADQUISICIÓN DE APARATOS PARA EQUIPAR LABORATORIO EN EL HOSPITAL DE HUMBERTO 1º","CONTADOR HEMATOLOGICO, ESTUFA DE CULTIVO, CENTRIFUGA, AGITADOR, BAÑO TERMOSTATIZADO, MICROPIPETAS AUTOMÁTICAS, ANALIZADOR HEMATOLOGICO, ANALIZADOR DE IONES, ESTUFA DE ESTERILIZACIÓN.-","EQUIP.MEDICO P/HOSPITALES Y CENTROS SANITARIOS/EQUIPOS-UTILES-INSUMOS PARA LABORATORIO","PESOS",1008,"HOSPITAL SAMCO DE HUMBERTO PRIMERO","HOSPITAL SAMCO DE HUMBERTO PRIMERO","23-08-2018 09:00 hs.","SAMCO HUMBERTO 1º","PESOS"," $  1.008,500",,"https://www.santafe.gov.ar/gestionesdecompras/site/gestion.php?idGestion=121277&contar=1&solodocs=1","EN TRAMITE","23-08-2018 23:20 hs."
